Sheet: Dalykai
A1: Subjects | B1: Groups | C1: Priority | D1: Max. pupils
A2: Ps | B2: e1 | C2: 5 | D2: 30
A3: T | B3: e1 | C3: 5 | D3: 30
A4: E | B4: e1 | C4: 5 | D4: 30
A5: Lk | B5: but | C5: 5 | D5: 25
A6: A1 | B6: e2 | C6: 3 | D6: 20
A7: V1 | B7: e2 | C7: 3 | D7: 20
A8: R1 | B8: e2 | C8: 3 | D8: 20
A9: Pr1 | B9: e2 | C9: 3 | D9: 20
A10: A2 | B10: e3 | C10: 3 | D10: 20
A11: V2 | B11: e3 | C11: 3 | D11: 20
A12: R2 | B12: e3 | C12: 3 | D12: 20
A13: Pr2 | B13: e3 | C13: 3 | D13: 20
A14: Ist | B14: pas | C14: 4 | D14: 30
A15: Geo | B15: pas | C15: 4 | D15: 30
A16: Mat | B16: but | C16: 5 | D16: 30
A17: Inf | B17: pas | C17: 5 | D17: 15
A18: Biol | B18: pas | C18: 4 | D18: 30
A19: Fiz | B19: pas | C19: 4 | D19: 30
A20: Chem | B20: pas | C20: 4 | D20: 30
A21: D | B21: pas | C21: 5 | D21: 30
A22: M | B22: pas | C22: 5 | D22: 30
A23: Te | B23: pas | C23: 5 | D23: 30
A24: S | B24: pas | C24: 2 | D24: 30
A25: KK | B25: but | C25: 1 | D25: 30
A26: lot | B26: pas | C26: 3 | D26: 30
A27: isp | B27: pas | C27: 3 | D27: 30
A28: gp | B28: pas | C28: 3 | D28: 30
A29: br | B29: pas | C29: 2 | D29: 30
A30: ek | B30: pas | C30: 5 | D30: 30
A31: pb | B31: pas | C31: 2 | D31: 30
A32: PC | B32: pas | C32: 4 | D32: 30

Sheet: mokytojai
A2: grupe | B2: Eil. | C2: Dalykas | D2: Pavarde_Vardas | E2: Kabinetas | F2: Val.sk | G2: Trump | H2: Klases kuriom desto mokytojas | I2: Pageidavimai / Laisvadieniai
A3: 1 | B3: 1 | C3: Etika; Tikyba; | D3: Martinaitienė Laura | E3: 101; 102; 103; 104; 105; 106; 107; 109; 110; 111; 112; 113; 114; 115; 201; 202; 203; 204; 205; 206; 207; 208; 209; 212; 213; 214; 215; 216; 217; 218; 219; 220; #101; 102; 103; 104; 105; 106; 107; 109; 110; 111; 112; 113; 114; 115; 201; 202; 203; 204; 205; 206; 207; 208; 209; 212; 213; 214; 215; 216; 217; 218; 219; 220; | F3: 30;30; | G3: E;T; | H3: 11b; 11c; 11d; 11e; 11f; 11g; #11a; 11b; 11c; 11d; 11e; 11f; 11g;
B4: 2 | C4: Etika; Tikyba; | D4: Patamsienė Jolanta | E4: 101; 102; 103; 104; 105; 106; 107; 109; 110; 111; 112; 113; 114; 115; 201; 202; 203; 204; 205; 206; 207; 208; 209; 212; 213; 214; 215; 216; 217; 218; 219; 220; #101; 102; 103; 104; 105; 106; 107; 109; 110; 111; 112; 113; 114; 115; 201; 202; 203; 204; 205; 206; 207; 208; 209; 212; 213; 214; 215; 216; 217; 218; 219; 220; | F4: 30;30; | G4: E;T; | H4: 11b; 11c; 11d; 11e; 11f; 11g; #11a; 11b; 11c; 11d; 11e; 11f; 11g;
B5: 3 | C5: Psicholigija | D5: Maciulevičienė Natalija | E5: 101; 102; 103; 104; 105; 106; 107; 109; 110; 111; 112; 113; 114; 115; 201; 202; 203; 204; 205; 206; 207; 208; 209; 212; 213; 214; 215; 216; 217; 218; 219; 220; | F5: 30; | G5: Ps | H5: 11a; 11b; 11c; 11d; 11e; 11f; 11g; | I5: 1;2;3;
A6: 2 | B6: 4 | C6: Leit.k. | D6: Vasiliauskaitė Nijolė | E6: 101; 102; 103; 104; 105; 106; 107; 109; 110; 111; 112; 113; 114; 115; 201; 202; 203; 204; 205; 206; 207; 208; 209; 212; 213; 214; 215; 216; 217; 218; 219; 220; | F6: 35; | G6: Lk | H6: 12a; 12b; 12c; 12d; 12e; 12f;
B7: 5 | C7: Leit.k. | D7: Lasauskienė Lilija | E7: 101; 102; 103; 104; 105; 106; 107; 109; 110; 111; 112; 113; 114; 115; 201; 202; 203; 204; 205; 206; 207; 208; 209; 212; 213; 214; 215; 216; 217; 218; 219; 220; | F7: 35; | G7: Lk | H7: 11a; 11b; 11c; 11d; 11e; 11f; 11g; 12a; 12b; 12c; 12d; 12e; 12f;
B8: 6 | C8: Leit.k. | D8: Bundoniene Orinta | E8: 101; 102; 103; 104; 105; 106; 107; 109; 110; 111; 112; 113; 114; 115; 201; 202; 203; 204; 205; 206; 207; 208; 209; 212; 213; 214; 215; 216; 217; 218; 219; 220; | F8: 35; | G8: Lk | H8: 11e; 11f; 12a; 12c; 12d; 12f;
B9: 7 | C9: Leit.k. | D9: Kalveliene Laima | E9: 101; 102; 103; 104; 105; 106; 107; 109; 110; 111; 112; 113; 114; 115; 201; 202; 203; 204; 205; 206; 207; 208; 209; 212; 213; 214; 215; 216; 217; 218; 219; 220; | F9: 35; | G9: Lk | H9: 11d; 11e; 11f; 12e;
B10: 8 | C10: Leit.k. | D10: Kucinskiene Anzelika | E10: 101; 102; 103; 104; 105; 106; 107; 109; 110; 111; 112; 113; 114; 115; 201; 202; 203; 204; 205; 206; 207; 208; 209; 212; 213; 214; 215; 216; 217; 218; 219; 220; | F10: 35; | G10: Lk | H10: 11b; 11c; 11g; 12a; 12b; 12e; 12f; 12a; 12b; 12c; 12e; 12f;
B11: 9 | C11: Leit.k. | D11: Miliseviciute Sigita | E11: 101; 102; 103; 104; 105; 106; 107; 109; 110; 111; 112; 113; 114; 115; 201; 202; 203; 204; 205; 206; 207; 208; 209; 212; 213; 214; 215; 216; 217; 218; 219; 220; | F11: 35; | G11: Lk | H11: 12a; 12c; 12d; 12f;
B12: 10 | C12: Leit.k. | D12: Paradauskiene Asta | E12: 101; 102; 103; 104; 105; 106; 107; 109; 110; 111; 112; 113; 114; 115; 201; 202; 203; 204; 205; 206; 207; 208; 209; 212; 213; 214; 215; 216; 217; 218; 219; 220; | F12: 35; | G12: Lk | H12: 11b; 11c; 11d; 11e; 11f; 11g; 12a; 12b; 12c; 12d; 12e; 12f;
B13: 11 | C13: Leit.k. | D13: Poskeviciute Dalia | E13: 101; 102; 103; 104; 105; 106; 107; 109; 110; 111; 112; 113; 114; 115; 201; 202; 203; 204; 205; 206; 207; 208; 209; 212; 213; 214; 215; 216; 217; 218; 219; 220; | F13: 35; | G13: Lk | H13: 11a; 11b; 11c; 11d; 11e; 11f; 11g;
B14: 12 | C14: Leit.k. | D14: Ramoskiene Aukse | E14: 101; 102; 103; 104; 105; 106; 107; 109; 110; 111; 112; 113; 114; 115; 201; 202; 203; 204; 205; 206; 207; 208; 209; 212; 213; 214; 215; 216; 217; 218; 219; 220; | F14: 35; | G14: Lk | H14: 11a; 11b; 11c; 11d; 11e; 11f; 11g; 12a; 12b; 12c; 12d; 12e; 12f;
B15: 13 | C15: Leit.k. | D15: Jaugiene Dona | E15: 101; 102; 103; 104; 105; 106; 107; 109; 110; 111; 112; 113; 114; 115; 201; 202; 203; 204; 205; 206; 207; 208; 209; 212; 213; 214; 215; 216; 217; 218; 219; 220; | F15: 35; | G15: Lk | H15: 11a; 11b; 11c; 11d; 11e; 11f; 11g;
A16: 3 | B16: 14 | C16: Anglų | D16: Zarauskiene Renata | E16: 101; 102; 103; 104; 105; 106; 107; 109; 110; 111; 112; 113; 114; 115; 201; 202; 203; 204; 205; 206; 207; 208; 209; 212; 213; 214; 215; 216; 217; 218; 219; 220; | F16: 28; | G16: A2 | H16: 11d; 11e; 11f; 11g; 12a; 12b; 12c; | I16: 1;4;5;
B17: 15 | C17: Anglų | D17: Kruopiene Ausra | E17: 101; 102; 103; 104; 105; 106; 107; 109; 110; 111; 112; 113; 114; 115; 201; 202; 203; 204; 205; 206; 207; 208; 209; 212; 213; 214; 215; 216; 217; 218; 219; 220; | F17: 28; | G17: A2 | H17: 11b; 11c; 11e; 11f; 11g; 12e; 12f; | I17: 2;3;4;
B18: 16 | C18: Anglų | D18: Bosulajeva Tatjana | E18: 101; 102; 103; 104; 105; 106; 107; 109; 110; 111; 112; 113; 114; 115; 201; 202; 203; 204; 205; 206; 207; 208; 209; 212; 213; 214; 215; 216; 217; 218; 219; 220; | F18: 28; | G18: A2 | H18: 12a; 12b; 12c; 12d; 12e; 12f;
B19: 17 | C19: Anglų | D19: Gontiene Ausra | E19: 101; 102; 103; 104; 105; 106; 107; 109; 110; 111; 112; 113; 114; 115; 201; 202; 203; 204; 205; 206; 207; 208; 209; 212; 213; 214; 215; 216; 217; 218; 219; 220; | F19: 28; | G19: A1 | H19: 11d; 11e; 11f; 11g; 12a; 12b; 12c; 12d; 12e; 12f; | I19: 1;5;
B20: 18 | C20: Anglų | D20: Januskeviciute Irena | E20: 101; 102; 103; 104; 105; 106; 107; 109; 110; 111; 112; 113; 114; 115; 201; 202; 203; 204; 205; 206; 207; 208; 209; 212; 213; 214; 215; 216; 217; 218; 219; 220; | F20: 30; | G20: A1 | H20: 11b; 11c; 11d; 11e; 11f; 11g;12d;
B21: 19 | C21: Anglų | D21: Januskiene Birute | E21: 101; 102; 103; 104; 105; 106; 107; 109; 110; 111; 112; 113; 114; 115; 201; 202; 203; 204; 205; 206; 207; 208; 209; 212; 213; 214; 215; 216; 217; 218; 219; 220; | F21: 28; | G21: A1 | H21: 11a; 11b; 11c; 11d; 11e; 11f; 11g; | I21: 1;2;3;
B22: 20 | C22: Anglų | D22: Kavalniene Elze | E22: 101; 102; 103; 104; 105; 106; 107; 109; 110; 111; 112; 113; 114; 115; 201; 202; 203; 204; 205; 206; 207; 208; 209; 212; 213; 214; 215; 216; 217; 218; 219; 220; | F22: 23; | G22: A2 | H22: 11a; 11b; 11c; 11d; 11e; 11f; 11g;
B23: 21 | C23: Anglų | D23: Liutkute Jurgita | E23: 101; 102; 103; 104; 105; 106; 107; 109; 110; 111; 112; 113; 114; 115; 201; 202; 203; 204; 205; 206; 207; 208; 209; 212; 213; 214; 215; 216; 217; 218; 219; 220; | F23: 30; | G23: A1 | H23: 11c; 11f; 11g; 12a; 12b; 12c; 12d; 12e; 12f; | I23: 1;2;5;
B24: 22 | C24: Vokiečių | D24: Miciunas Algis | E24: 101; 102; 103; 104; 105; 106; 107; 109; 110; 111; 112; 113; 114; 115; 201; 202; 203; 204; 205; 206; 207; 208; 209; 212; 213; 214; 215; 216; 217; 218; 219; 220; | F24: 24; | G24: V1 | H24: 11a; 11b; 11c; 11d; 11e; 11f; 11g; 12a; 12b; 12c; 12d; 12e; 12f;
B25: 23 | C25: Vokiečių | D25: Miliukaite Inga | E25: 101; 102; 103; 104; 105; 106; 107; 109; 110; 111; 112; 113; 114; 115; 201; 202; 203; 204; 205; 206; 207; 208; 209; 212; 213; 214; 215; 216; 217; 218; 219; 220; | F25: 25; | G25: V2 | H25: 11a; 11b; 11c; 11d; 11e; 11f; 11g; 12a; 12b; 12c; 12d; 12e; 12f;
B26: 24 | C26: Rusų | D26: Simonaitiene Rima | E26: 101; 102; 103; 104; 105; 106; 107; 109; 110; 111; 112; 113; 114; 115; 201; 202; 203; 204; 205; 206; 207; 208; 209; 212; 213; 214; 215; 216; 217; 218; 219; 220; | F26: 24; | G26: R1 | H26: 11a; 11b; 11c; 11e; 11f; 11g; 12d; 12e; 12f;
B27: 25 | C27: Rusų | D27: Skorupa Pavel | E27: 101; 102; 103; 104; 105; 106; 107; 109; 110; 111; 112; 113; 114; 115; 201; 202; 203; 204; 205; 206; 207; 208; 209; 212; 213; 214; 215; 216; 217; 218; 219; 220; | F27: 24; | G27: R2 | H27: 11a; 11b; 11c; 11e; 11f; 11g; 12d; 12e; 12f; | I27: 2;3;5;
B28: 26 | C28: Rusų | D28: Stasiulaityte Aida | E28: 101; 102; 103; 104; 105; 106; 107; 109; 110; 111; 112; 113; 114; 115; 201; 202; 203; 204; 205; 206; 207; 208; 209; 212; 213; 214; 215; 216; 217; 218; 219; 220; #101; 102; 103; 104; 105; 106; 107; 109; 110; 111; 112; 113; 114; 115; 201; 202; 203; 204; 205; 206; 207; 208; 209; 212; 213; 214; 215; 216; 217; 218; 219; 220; | F28: 25;25; | G28: R1;R2; | H28: 12a; 12b; 12c; #12a; 12b; 12c;
B29: 27 | C29: Prancūzų | D29: Ucinskiene Jurate | E29: 101; 102; 103; 104; 105; 106; 107; 109; 110; 111; 112; 113; 114; 115; 201; 202; 203; 204; 205; 206; 207; 208; 209; 212; 213; 214; 215; 216; 217; 218; 219; 220; #101; 102; 103; 104; 105; 106; 107; 109; 110; 111; 112; 113; 114; 115; 201; 202; 203; 204; 205; 206; 207; 208; 209; 212; 213; 214; 215; 216; 217; 218; 219; 220; | F29: 24;24; | G29: Pr1;Pr2; | H29: 11a; 11b; 11c; 11d; 11e; 11f; 11g; 12a; 12b; 12c; 12d; 12e; 12f; #11a; 11b; 11c; 11d; 11e; 11f; 11g; 12a; 12b; 12c; 12d; 12e; 12f;
A30: 4 | B30: 28 | C30: Istorija | D30: Valaviciute Ingrida | E30: 101; 102; 103; 104; 105; 106; 107; 109; 110; 111; 112; 113; 114; 115; 201; 202; 203; 204; 205; 206; 207; 208; 209; 212; 213; 214; 215; 216; 217; 218; 219; 220; | F30: 26; | G30: Ist | H30: 11a; 11b; 11c; 11d; 11e; 11f; 11g;
B31: 29 | C31: Istorija | D31: Biziuliene Irma | E31: 101; 102; 103; 104; 105; 106; 107; 109; 110; 111; 112; 113; 114; 115; 201; 202; 203; 204; 205; 206; 207; 208; 209; 212; 213; 214; 215; 216; 217; 218; 219; 220; | F31: 26; | G31: Ist | H31: 11b; 11c; 11d; 11e; 11f;
B32: 30 | C32: Istorija | D32: Bieliauskiene Aldona | E32: 101; 102; 103; 104; 105; 106; 107; 109; 110; 111; 112; 113; 114; 115; 201; 202; 203; 204; 205; 206; 207; 208; 209; 212; 213; 214; 215; 216; 217; 218; 219; 220; | F32: 26; | G32: Ist | H32: 11a; 11c; 11d; 11g; 12a; 12c; 12f;
B33: 31 | C33: Istorija | D33: Kanapiene Zita | E33: 101; 102; 103; 104; 105; 106; 107; 109; 110; 111; 112; 113; 114; 115; 201; 202; 203; 204; 205; 206; 207; 208; 209; 212; 213; 214; 215; 216; 217; 218; 219; 220; | F33: 26; | G33: Ist | H33: 11a; 11b; 11f; 11g; 12b; 12c; 12d; | I33: 1;2;
B34: 32 | C34: Geografija | D34: Mazintiene Birute | E34: 101; 102; 103; 104; 105; 106; 107; 109; 110; 111; 112; 113; 114; 115; 201; 202; 203; 204; 205; 206; 207; 208; 209; 212; 213; 214; 215; 216; 217; 218; 219; 220; | F34: 20; | G34: Geo | H34: 11a; 11b; 11c; 11d; 11e; 11f; 11g; | I34: 1;2;
A35: 5 | B35: 33 | C35: Matematika | D35: Smitaite Ona | E35: 101; 102; 103; 104; 105; 106; 107; 109; 110; 111; 112; 113; 114; 115; 201; 202; 203; 204; 205; 206; 207; 208; 209; 212; 213; 214; 215; 216; 217; 218; 219; 220; | F35: 35; | G35: Mat | H35: 11c; 11d; 11f; 11g; 12b;
B36: 34 | C36: Matematika | D36: Zuravliova Nina | E36: 101; 102; 103; 104; 105; 106; 107; 109; 110; 111; 112; 113; 114; 115; 201; 202; 203; 204; 205; 206; 207; 208; 209; 212; 213; 214; 215; 216; 217; 218; 219; 220; | F36: 35; | G36: Mat | H36: 12b; | I36: 2;4;5;
B37: 35 | C37: Matematika | D37: Bieliuniene Palma | E37: 101; 102; 103; 104; 105; 106; 107; 109; 110; 111; 112; 113; 114; 115; 201; 202; 203; 204; 205; 206; 207; 208; 209; 212; 213; 214; 215; 216; 217; 218; 219; 220; | F37: 35; | G37: Mat | H37: 11b; 11e; 11f; 11g; 12c; 12d; | I37: 3;
B38: 36 | C38: Matematika | D38: Rudminiene Migle | E38: 101; 102; 103; 104; 105; 106; 107; 109; 110; 111; 112; 113; 114; 115; 201; 202; 203; 204; 205; 206; 207; 208; 209; 212; 213; 214; 215; 216; 217; 218; 219; 220; | F38: 35; | G38: Mat | H38: 11a; 11b; 11c; 11d; 11e; 11f; 11g;
B39: 37 | C39: Matematika | D39: Abraitiene Danguole | E39: 101; 102; 103; 104; 105; 106; 107; 109; 110; 111; 112; 113; 114; 115; 201; 202; 203; 204; 205; 206; 207; 208; 209; 212; 213; 214; 215; 216; 217; 218; 219; 220; | F39: 35; | G39: Mat | H39: 11a; 11b; 11c; 11d; 11e; 11f; 11g; 12c; 12f;
B40: 38 | C40: Matematika | D40: Jonykiene Odeta | E40: 101; 102; 103; 104; 105; 106; 107; 109; 110; 111; 112; 113; 114; 115; 201; 202; 203; 204; 205; 206; 207; 208; 209; 212; 213; 214; 215; 216; 217; 218; 219; 220; | F40: 35; | G40: Mat | H40: 11a; 11b; 11c; 11d; 11e; 11f; 11g; | I40: 4;
B41: 39 | C41: Matematika | D41: Guobiene Jurgita | E41: 101; 102; 103; 104; 105; 106; 107; 109; 110; 111; 112; 113; 114; 115; 201; 202; 203; 204; 205; 206; 207; 208; 209; 212; 213; 214; 215; 216; 217; 218; 219; 220; | F41: 25; | G41: Mat | H41: 11a; 11b; 11c; 11d; 11g; 12a; 12c; 12d; 12f;
B42: 40 | C42: Matematika | D42: Kavaliauskaite Regina | E42: 101; 102; 103; 104; 105; 106; 107; 109; 110; 111; 112; 113; 114; 115; 201; 202; 203; 204; 205; 206; 207; 208; 209; 212; 213; 214; 215; 216; 217; 218; 219; 220; | F42: 28; | G42: Mat | H42: 11b; 11d; 11e; | I42: 1;2;
A43: 6 | B43: 41 | C43: Informatika | D43: Kibickiene Ingrida | E43: 221; 211; 210; 108; | F43: 25; | G43: Inf | H43: 11a; 11b; 11c; 11d; 11e; 11f; 11g; 12d; 12a;
B44: 42 | C44: Informatika | D44: Melaikiene Arija | E44: 221; 211; 210; 108; | F44: 15; | G44: Inf | H44: 12c; 12d; 12f;
B45: 43 | C45: Informatika | D45: Sabaliauskiene Ausra | E45: 221; 211; 210; 108; | F45: 25; | G45: Inf | H45: 11a; 11b; 11c; 11d; 11e; 11f; 11g; 12e; | I45: 2;4;
A46: 7 | B46: 44 | C46: Biologija | D46: Butkute Karina | E46: 301; 302; 303; 304; 305; 306; 307; 308; 309; 310; 311; 312; 313; 314; 315; 316; 317; 318; 319; 320; 321; 322; 323; 324; 325; | F46: 10; | G46: Biol | H46: 11a; 11b; 11c; 11d; 11e; 11f; 11g; | I46: 2;3;5;
B47: 45 | C47: Biologija | D47: Bukauskiene Rimante | E47: 301; 302; 303; 304; 305; 306; 307; 308; 309; 310; 311; 312; 313; 314; 315; 316; 317; 318; 319; 320; 321; 322; 323; 324; 325; | F47: 25; | G47: Biol | H47: 11b; 11f; 11g; 12c; 12d; 12f;
B48: 46 | C48: Biologija | D48: Jankauskiene zivile | E48: 301; 302; 303; 304; 305; 306; 307; 308; 309; 310; 311; 312; 313; 314; 315; 316; 317; 318; 319; 320; 321; 322; 323; 324; 325; | F48: 25; | G48: Biol | H48: 11c; 12e; | I48: 1;2;3;4;
B49: 47 | C49: Biologija | D49: Keniausiene Ada | E49: 301; 302; 303; 304; 305; 306; 307; 308; 309; 310; 311; 312; 313; 314; 315; 316; 317; 318; 319; 320; 321; 322; 323; 324; 325; | F49: 25; | G49: Biol | H49: 11e; 12a; 12c; 12d; 12f; 12e;
A50: 8 | B50: 48 | C50: Fizika | D50: Medisauskiene Regina | E50: 301; 302; 303; 304; 305; 306; 307; 308; 309; 310; 311; 312; 313; 314; 315; 316; 317; 318; 319; 320; 321; 322; 323; 324; 325; | F50: 27; | G50: Fiz | H50: 11b; 11c; 11d;
B51: 49 | C51: Fizika | D51: Osipaviciute Ruta | E51: 301; 302; 303; 304; 305; 306; 307; 308; 309; 310; 311; 312; 313; 314; 315; 316; 317; 318; 319; 320; 321; 322; 323; 324; 325; | F51: 23; | G51: Fiz | H51: 11d; 12a; 12c; | I51: 3;4;5;
B52: 50 | C52: Fizika | D52: Senulyte Sigita | E52: 301; 302; 303; 304; 305; 306; 307; 308; 309; 310; 311; 312; 313; 314; 315; 316; 317; 318; 319; 320; 321; 322; 323; 324; 325; | F52: 15; | G52: Fiz | H52: 11b; 11c; 11d; 11e; 11f; 11g; 12a; 12b; 12c; 12d; 12e; 12f; | I52: 1;2;3;4;
A53: 9 | B53: 51 | C53: Chemija | D53: Sudvojiene Terese | E53: 301; 302; 303; 304; 305; 306; 307; 308; 309; 310; 311; 312; 313; 314; 315; 316; 317; 318; 319; 320; 321; 322; 323; 324; 325; | F53: 28; | G53: Chem | H53: 11b; 11c; 11d; 11e; 11f; 11g; 12a; 12b; 12c; 12d; 12e; 12f;
B54: 52 | C54: Chemija | D54: Veikutyte Ramune | E54: 301; 302; 303; 304; 305; 306; 307; 308; 309; 310; 311; 312; 313; 314; 315; 316; 317; 318; 319; 320; 321; 322; 323; 324; 325; | F54: 22; | G54: Chem | H54: 11b; 11c; 12a; 12b; 12c; 12d; 12e; 12f;
A55: 10 | B55: 53 | C55: Muzika | D55: Velickiene Laima | E55: 104; 110; | F55: 30; | G55: M | H55: 11a; 11b; 12a; 12b; 12c; 12d; 12e; 12f;
B56: 54 | C56: Dailė; Braižyba; | D56: Ziuriene Daiva | E56: 101; 102; 103; 104; 105; 106; 107; 109; 110; 111; 112; 113; 114; 115; 201; 202; 203; 204; 205; 206; 207; 208; 209; 212; 213; 214; 215; 216; 217; 218; 219; 220; #101; 102; 103; 104; 105; 106; 107; 109; 110; 111; 112; 113; 114; 115; 201; 202; 203; 204; 205; 206; 207; 208; 209; 212; 213; 214; 215; 216; 217; 218; 219; 220; | F56: 30;30; | G56: D;br; | H56: 11a; 11b; 11c; 11d; 11e; 11f; 11g; #11a; 11b; 11c; 11d; 11e; 11f; 11g; 12a; 12b; 12c; 12d; 12e; 12f;
B57: 55 | C57: Teatras | D57: Rafalovic Jaroslov | E57: 210; 0001; 0002; | F57: 30; | G57: Te | H57: 11a; 11b; 11c; 11d; 11e; 11f; 11g; 12a; 12b; 12c; 12d; 12e; 12f;
B58: 56 | C58: Choreografija | D58: Rasimas Darius | E58: 210; 0001; 0002; | F58: 30; | G58: S | H58: 11a; 11b; 11c; 11d; 11e; 11f; 11g;
A59: 11 | B59: 57 | C59: Kūno kultūra | D59: Balseviciene Irma | E59: 0002; | F59: 30; | G59: KK | H59: 11b; 11c; 11e; 11f; 11g; 12d; 12e; 12f;
B60: 58 | C60: Kūno kultūra | D60: Kanciauskas Vidmantas | E60: 0001; | F60: 30; | G60: KK | H60: 11a; 11c; 11d; 11f; 11g; 12a; 12b; 12c;
B61: 59 | C61: Kūno kultūra | D61: Kanciauskiene Jolita | E61: 0002; | F61: 30; | G61: KK | H61: 11a; 11d; 12a; 12c; | I61: 1;3;5;
B62: 60 | C62: Kūno kultūra | D62: Karoseviciene Ina | E62: 0001; | F62: 30; | G62: KK | H62: 11b; 11c; 11d; 11e; 12e; 12f;
A63: 12 | B63: 61 | C63: Lotynų | D63: Taraseviciene Rima | E63: 101; 102; 103; 104; 105; 106; 107; 109; 110; 111; 112; 113; 114; 115; 201; 202; 203; 204; 205; 206; 207; 208; 209; 212; 213; 214; 215; 216; 217; 218; 219; 220; | F63: 25; | G63: lot | H63: 11a; 11b; 11c; 11d; 11e; 11f; 11g; 12a; 12b; 12c; 12d; 12e; 12f;
B64: 62 | C64: Ispanų | D64: Adomenas Algimantas | E64: 101; 102; 103; 104; 105; 106; 107; 109; 110; 111; 112; 113; 114; 115; 201; 202; 203; 204; 205; 206; 207; 208; 209; 212; 213; 214; 215; 216; 217; 218; 219; 220; | F64: 25; | G64: isp | H64: 11a; 11b; 11c; 11d; 11e; 11f; 11g; | I64: 1;2;4;5;
B65: 63 | C65: Geopolitika; Gegrafija; | D65: Kavaliauskas Ovidijus | E65: 101; 102; 103; 104; 105; 106; 107; 109; 110; 111; 112; 113; 114; 115; 201; 202; 203; 204; 205; 206; 207; 208; 209; 212; 213; 214; 215; 216; 217; 218; 219; 220; #101; 102; 103; 104; 105; 106; 107; 109; 110; 111; 112; 113; 114; 115; 201; 202; 203; 204; 205; 206; 207; 208; 209; 212; 213; 214; 215; 216; 217; 218; 219; 220; | F65: 30;25; | G65: gp;Geo; | H65: 11a; 12a; 12b; 12c; 12d; 12e; 12f; #11a; 11b; 11c; 11d; 11e; 11f; 11g; 12a; 12b; 12c; 12d; 12e; 12f;
B66: 64 | C66: Ekonimika | D66: Kvedaravicius Antanas | E66: 101; 102; 103; 104; 105; 106; 107; 109; 110; 111; 112; 113; 114; 115; 201; 202; 203; 204; 205; 206; 207; 208; 209; 212; 213; 214; 215; 216; 217; 218; 219; 220; | F66: 25; | G66: ek | H66: 11a; 11b; 11c; 11d; 11e; 11f; 11g; 12a; 12b; 12c; 12d; 12e; 12f;
B67: 65 | C67: PB | D67: Atstopaite Nomeda | E67: 101; 102; 103; 104; 105; 106; 107; 109; 110; 111; 112; 113; 114; 115; 201; 202; 203; 204; 205; 206; 207; 208; 209; 212; 213; 214; 215; 216; 217; 218; 219; 220; | F67: 25; | G67: pb | H67: 12a; 12b; 12c; 12d; 12e; 12f; | I67: 2;3;4;5;
B68: 66 | C68: PComputer | D68: Vickackiene Lina | E68: 221; 211; 210; 108; | F68: 25; | G68: PC | H68: 11b; 11c; 11d; 11f; 11g; 12a; 12b; 12c; 12e; | I68: 2;3;4;5;

Sheet: 11a
A1: Eil. | B1: Pavarde Vardas | C1: Dor. ugd. | F1: Leit.k. | G1: 1 užs.kalba | K1: 2 užs.kalba | O1: Ist | P1: Geo | Q1: Mat | R1: Inf | S1: Biol | T1: Fiz | U1: Chem | V1: Menai | Z1: KK | AA1: Pasirenkami | AH1: Viso
A2: Ps | B2: T | C2: E | E2: A1 | F2: V1 | G2: R1 | H2: Pr1 | I2: A2 | J2: V2 | K2: R2 | L2: Pr2 | T2: D | U2: M | V2: Te | W2: S | X2: lot | Y2: isp | Z2: gp | AA2: br | AB2: ek | AC2: pb | AD2: PC
A3: 1 | B3: 11a_Pavarde_1 Vardas_1 | C3: 2 | F3: 5A | G3: 5A | L3: 2B | O3: 4A | P3: 2B | Q3: 3B | S3: 2B | Y3: 3 | Z3: 2B | AD3: 1 | AH3: of:=SUM([.C3:.AG3]) -> 6
A4: 2 | B4: 11a_Pavarde_2 Vardas_2 | C4: 2 | F4: 5A | G4: 4A | M4: 2B | O4: 3A | P4: 2B | Q4: 5A | R4: 1B | S4: 2B | X4: 3 | Z4: 2B | AD4: 1 | AH4: of:=SUM([.C4:.AG4]) -> 6
A5: 3 | B5: 11a_Pavarde_3 Vardas_3 | C5: 2 | F5: 5A | G5: 4A | N5: 2B | O5: 3A | Q5: 3B | R5: 1B | S5: 2B | V5: 3 | Z5: 2B | AA5: 1 | AB5: 1 | AH5: of:=SUM([.C5:.AG5]) -> 7
A6: 4 | B6: 11a_Pavarde_4 Vardas_4 | C6: 2 | F6: 5A | G6: 5A | M6: 2B | O6: 3A | Q6: 3B | R6: 1B | S6: 2B | V6: 3 | Z6: 2B | AH6: of:=SUM([.C6:.AG6]) -> 5
A7: 5 | B7: 11a_Pavarde_5 Vardas_4 | C7: 2 | F7: 5A | G7: 4A | O7: 4A | Q7: 5A | R7: 1B | S7: 2B | W7: 3 | Z7: 2 | AH7: of:=SUM([.C7:.AG7]) -> 7
A8: 6 | B8: 11a_Pavarde_6 Vardas_5 | C8: 2 | F8: 6A | G8: 4A | L8: 2B | O8: 4A | Q8: 5A | R8: 1B | S8: 2B | V8: 3 | Z8: 2 | AH8: of:=SUM([.C8:.AG8]) -> 7
A9: 7 | B9: 11a_Pavarde_7 Vardas_6 | C9: 2 | F9: 5A | G9: 4A | M9: 2B | O9: 3A | P9: 2B | Q9: 4A | S9: 2B | X9: 3 | Z9: 2B | AH9: of:=SUM([.C9:.AG9]) -> 5
A10: 8 | B10: 11a_Pavarde_8 Vardas_7 | C10: 2 | F10: 6A | G10: 4A | O10: 3A | P10: 2B | Q10: 5A | S10: 2B | Y10: 3 | Z10: 2B | AB10: 1 | AC10: 1 | AE10: 1 | AH10: of:=SUM([.C10:.AG10]) -> 8
A11: 9 | B11: 11a_Pavarde_9 Vardas_8 | C11: 2 | F11: 5A | G11: 5A | L11: 2B | O11: 4A | Q11: 3B | S11: 2B | Y11: 4 | Z11: 2B | AH11: of:=SUM([.C11:.AG11]) -> 6
A12: 10 | B12: 11a_Pavarde_10 Vardas_9 | C12: 2 | F12: 5A | G12: 4A | O12: 3A | P12: 3A | Q12: 5A | R12: 1B | S12: 2B | X12: 4 | Z12: 2B | AH12: of:=SUM([.C12:.AG12]) -> 6
A13: 11 | B13: 11a_Pavarde_11 Vardas_10 | C13: 2 | F13: 5A | G13: 4A | O13: 2B | P13: 3A | Q13: 3B | S13: 2B | Y13: 3 | Z13: 2B | AB13: 1 | AD13: 1 | AE13: 1 | AH13: of:=SUM([.C13:.AG13]) -> 8
A14: 12 | B14: 11a_Pavarde_12 Vardas_11 | C14: 2 | F14: 5A | G14: 4A | M14: 2B | O14: 3A | Q14: 3B | R14: 2A | S14: 2B | X14: 4 | Z14: 2B | AH14: of:=SUM([.C14:.AG14]) -> 6
A15: 13 | B15: 11a_Pavarde_13 Vardas_12 | C15: 2 | F15: 5A | G15: 5A | M15: 2B | O15: 3A | P15: 3A | Q15: 4A | S15: 2B | W15: 3 | Z15: 2B | AH15: of:=SUM([.C15:.AG15]) -> 5
A16: 14 | B16: 11a_Pavarde_14 Vardas_13 | C16: 2 | F16: 5A | G16: 5A | M16: 2B | O16: 4A | Q16: 3B | R16: 1B | S16: 2B | X16: 3 | Z16: 2B | AH16: of:=SUM([.C16:.AG16]) -> 5
A17: 15 | B17: 11a_Pavarde_15 Vardas_14 | C17: 2 | F17: 5A | G17: 4A | M17: 2B | O17: 4A | P17: 3A | Q17: 5A | S17: 2B | X17: 3 | Z17: 2B | AH17: of:=SUM([.C17:.AG17]) -> 5
A18: 16 | B18: 11a_Pavarde_16 Vardas_15 | C18: 2 | F18: 6A | G18: 5A | N18: 2B | O18: 3A | Q18: 4A | R18: 1B | S18: 2B | V18: 3 | Z18: 2B | AD18: 1 | AH18: of:=SUM([.C18:.AG18]) -> 6
A19: 17 | B19: 11a_Pavarde_17 Vardas_16 | C19: 2 | F19: 5A | G19: 4A | O19: 3A | P19: 2B | Q19: 5A | R19: 2A | S19: 2B | Y19: 3 | Z19: 2B | AA19: 1 | AH19: of:=SUM([.C19:.AG19]) -> 6
A20: 18 | B20: 11a_Pavarde_18 Vardas_17 | C20: 2 | F20: 5A | G20: 5A | M20: 2B | O20: 4A | Q20: 5A | R20: 1B | S20: 2B | X20: 3 | Z20: 2B | AH20: of:=SUM([.C20:.AG20]) -> 5
A21: 19 | B21: 11a_Pavarde_19 Vardas_18 | C21: 2 | F21: 6A | G21: 4A | O21: 4A | Q21: 6A | S21: 2B | X21: 3 | Z21: 2B | AB21: 1 | AH21: of:=SUM([.C21:.AG21]) -> 6
A22: 20 | B22: 11a_Pavarde_20 Vardas_19 | C22: 2 | F22: 5A | G22: 4A | L22: 2B | O22: 3A | Q22: 5A | S22: 2B | Y22: 3 | Z22: 2B | AB22: 1 | AC22: 1 | AE22: 1 | AH22: of:=SUM([.C22:.AG22]) -> 8

Sheet: 11b
A1: Eil. | B1: Pavarde Vardas | C1: Dor. ugd. | F1: Leit.k. | G1: 1 užs.kalba | K1: 2 užs.kalba | O1: Ist | P1: Geo | Q1: Mat | R1: Inf | S1: Biol | T1: Fiz | U1: Chem | V1: Menai | Z1: KK | AA1: Pasirenkami | AH1: Viso
A2: Ps | B2: T | C2: E | E2: A1 | F2: V1 | G2: R1 | H2: Pr1 | I2: A2 | J2: V2 | K2: R2 | L2: Pr2 | T2: D | U2: M | V2: Te | W2: S | X2: lot | Y2: isp | Z2: gp | AA2: br | AB2: ek | AC2: pb | AD2: PC
A3: 1 | B3: 11b_Pavarde_1 Vardas_1 | C3: 2 | F3: 6A | G3: 4A | O3: 4A | Q3: 5A | R3: 1B | U3: 2B | X3: 4 | Z3: 2 | AE3: 1 | AH3: of:=SUM([.C3:.AG3]) -> 9
A4: 2 | B4: 11b_Pavarde_2 Vardas_2 | C4: 2 | F4: 5A | G4: 4A | L4: 2B | O4: 3A | Q4: 5A | R4: 1B | U4: 2B | X4: 4 | Z4: 2 | AA4: 1 | AH4: of:=SUM([.C4:.AG4]) -> 9
A5: 3 | B5: 11b_Pavarde_3 Vardas_3 | C5: 2 | F5: 5A | G5: 4A | L5: 2B | O5: 3A | P5: 2B | Q5: 5A | R5: 1B | U5: 2B | V5: 3 | Z5: 2B | AC5: 1 | AH5: of:=SUM([.C5:.AG5]) -> 6
A6: 4 | B6: 11b_Pavarde_4 Vardas_4 | C6: 2 | F6: 5A | G6: 4A | O6: 3A | P6: 2B | Q6: 3B | R6: 2A | S6: 2B | V6: 4 | Z6: 2 | AH6: of:=SUM([.C6:.AG6]) -> 8
A7: 5 | B7: 11b_Pavarde_5 Vardas_4 | C7: 2 | F7: 5A | G7: 4A | L7: 2B | O7: 3A | Q7: 5A | R7: 1B | S7: 2B | W7: 4 | Z7: 2B | AB7: 1 | AH7: of:=SUM([.C7:.AG7]) -> 7
A8: 6 | B8: 11b_Pavarde_6 Vardas_5 | C8: 2 | F8: 5A | G8: 4A | L8: 2B | O8: 4A | Q8: 5A | S8: 2B | Y8: 4 | Z8: 2B | AH8: of:=SUM([.C8:.AG8]) -> 6
A9: 7 | B9: 11b_Pavarde_7 Vardas_6 | C9: 2 | F9: 5A | G9: 4A | M9: 2 | O9: 3A | Q9: 3B | S9: 2B | W9: 4 | Z9: 2 | AB9: 1 | AC9: 1 | AH9: of:=SUM([.C9:.AG9]) -> 12
A10: 8 | B10: 11b_Pavarde_8 Vardas_7 | C10: 2 | F10: 6A | G10: 4A | L10: 2B | O10: 4A | P10: 2B | Q10: 3B | R10: 1B | S10: 2B | X10: 3 | Z10: 2B | AH10: of:=SUM([.C10:.AG10]) -> 5
A11: 9 | B11: 11b_Pavarde_9 Vardas_8 | C11: 2 | F11: 6A | G11: 4A | O11: 4A | Q11: 6A | S11: 2B | Y11: 3 | Z11: 2 | AC11: 1 | AH11: of:=SUM([.C11:.AG11]) -> 8
A12: 10 | B12: 11b_Pavarde_10 Vardas_9 | E12: 2 | F12: 6A | G12: 4A | O12: 3A | Q12: 5A | R12: 2A | S12: 2B | Y12: 4 | Z12: 2 | AE12: 1 | AH12: of:=SUM([.C12:.AG12]) -> 9
A13: 11 | B13: 11b_Pavarde_11 Vardas_10 | E13: 2 | F13: 5A | G13: 4A | O13: 3A | Q13: 5A | R13: 1B | S13: 2B | Y13: 3 | Z13: 2 | AH13: of:=SUM([.C13:.AG13]) -> 7
A14: 12 | B14: 11b_Pavarde_12 Vardas_11 | C14: 2 | F14: 5A | G14: 4A | O14: 3A | Q14: 5A | R14: 1B | U14: 2B | Y14: 4 | Z14: 2 | AB14: 1 | AE14: 1 | AH14: of:=SUM([.C14:.AG14]) -> 10
A15: 13 | B15: 11b_Pavarde_13 Vardas_12 | E15: 2 | F15: 5A | G15: 4A | O15: 3A | P15: 2 | Q15: 5A | R15: 1B | S15: 2B | Y15: 3 | Z15: 2 | AH15: of:=SUM([.C15:.AG15]) -> 9
A16: 14 | B16: 11b_Pavarde_14 Vardas_13 | C16: 2 | F16: 6A | G16: 4A | L16: 2B | O16: 4A | Q16: 5A | R16: 2A | S16: 2B | X16: 3 | Z16: 2B | AH16: of:=SUM([.C16:.AG16]) -> 5
A17: 15 | B17: 11b_Pavarde_15 Vardas_14 | C17: 2 | F17: 6A | G17: 4A | O17: 4A | Q17: 6A | R17: 1B | S17: 2B | Y17: 4 | Z17: 2 | AH17: of:=SUM([.C17:.AG17]) -> 8
A18: 16 | B18: 11b_Pavarde_16 Vardas_15 | C18: 2 | F18: 5A | G18: 4A | M18: 2B | O18: 3A | P18: 3A | Q18: 3B | R18: 1B | S18: 2B | Y18: 3 | Z18: 2B | AC18: 1 | AH18: of:=SUM([.C18:.AG18]) -> 6
A19: 17 | B19: 11b_Pavarde_17 Vardas_16 | C19: 2 | F19: 6A | G19: 4A | O19: 3A | Q19: 5A | R19: 2A | S19: 2B | Y19: 4 | Z19: 2 | AD19: 1 | AE19: 1 | AH19: of:=SUM([.C19:.AG19]) -> 10
A20: 18 | B20: 11b_Pavarde_18 Vardas_17 | C20: 2 | F20: 5A | G20: 4A | M20: 2B | O20: 3A | Q20: 5A | R20: 1B | U20: 2B | X20: 4 | Z20: 2B | AH20: of:=SUM([.C20:.AG20]) -> 6
A21: 19 | B21: 11b_Pavarde_19 Vardas_18 | C21: 2 | F21: 5A | G21: 4A | O21: 3A | Q21: 5A | R21: 1B | S21: 2B | W21: 3 | Z21: 2 | AE21: 1 | AH21: of:=SUM([.C21:.AG21]) -> 8
A22: 20 | B22: 11b_Pavarde_20 Vardas_19 | E22: 2 | F22: 5A | G22: 4A | O22: 3A | P22: 2B | Q22: 5A | R22: 1B | S22: 2B | V22: 3 | Z22: 2 | AD22: 1 | AH22: of:=SUM([.C22:.AG22]) -> 8
A23: 21 | B23: 11b_Pavarde_21 Vardas_20 | C23: 2 | F23: 6A | G23: 4A | O23: 3A | Q23: 5A | R23: 2A | S23: 2B | Y23: 4 | Z23: 2 | AD23: 1 | AE23: 1 | AH23: of:=SUM([.C23:.AG23]) -> 10
A24: 22 | B24: 11b_Pavarde_22 Vardas_21 | E24: 2 | F24: 5A | G24: 4A | M24: 2B | O24: 3A | Q24: 6A | R24: 2A | S24: 2B | X24: 4 | Z24: 2B | AA24: 1 | AH24: of:=SUM([.C24:.AG24]) -> 7
A25: 23 | B25: 11b_Pavarde_23 Vardas_21 | E25: 2 | F25: 5A | G25: 4A | O25: 3A | P25: 2B | Q25: 4A | R25: 1B | S25: 2B | V25: 3 | Z25: 2 | AH25: of:=SUM([.C25:.AG25]) -> 7
A26: 24 | B26: 11b_Pavarde_24 Vardas_22 | C26: 2 | F26: 5A | G26: 4A | O26: 3A | Q26: 3B | R26: 1B | S26: 2B | V26: 3 | Z26: 2 | AH26: of:=SUM([.C26:.AG26]) -> 7
A27: 25 | B27: 11b_Pavarde_25 Vardas_22 | C27: 2 | F27: 5A | G27: 4A | O27: 3A | Q27: 5A | R27: 1B | S27: 2B | W27: 3 | Z27: 2 | AH27: of:=SUM([.C27:.AG27]) -> 7
A28: 26 | B28: 11b_Pavarde_26 Vardas_23 | C28: 2 | F28: 5A | G28: 4A | L28: 2 | O28: 3A | P28: 2B | Q28: 5A | R28: 1B | S28: 2B | X28: 3 | Z28: 2 | AE28: 1 | AH28: of:=SUM([.C28:.AG28]) -> 10
A29: 27 | B29: 11b_Pavarde_27 Vardas_23 | C29: 2 | F29: 5A | G29: 4A | O29: 4A | Q29: 5A | R29: 1B | S29: 2B | Y29: 3 | Z29: 2 | AE29: 1 | AH29: of:=SUM([.C29:.AG29]) -> 8

Sheet: 11c
A1: Eil. | B1: Pavarde Vardas | C1: Dor. ugd. | F1: Leit.k. | G1: 1 užs.kalba | K1: 2 užs.kalba | O1: Ist | P1: Geo | Q1: Mat | R1: Inf | S1: Biol | T1: Fiz | U1: Chem | V1: Menai | Z1: KK | AA1: Pasirenkami | AH1: Viso
A2: Ps | B2: T | C2: E | E2: A1 | F2: V1 | G2: R1 | H2: Pr1 | I2: A2 | J2: V2 | K2: R2 | L2: Pr2 | T2: D | U2: M | V2: Te | W2: S | X2: lot | Y2: isp | Z2: gp | AA2: br | AB2: ek | AC2: pb | AD2: PC
A3: 1 | B3: 11c_Pavarde_1 Vardas_1 | C3: 2 | F3: 5A | G3: 4A | O3: 4A | Q3: 5A | R3: 1B | T3: 2B | Y3: 3 | Z3: 2B | AE3: 1 | AH3: of:=SUM([.C3:.AG3]) -> 6
A4: 2 | B4: 11c_Pavarde_2 Vardas_2 | C4: 2 | F4: 5A | G4: 4A | O4: 4A | Q4: 3B | R4: 1B | T4: 2B | Y4: 4 | Z4: 2B | AE4: 1 | AH4: of:=SUM([.C4:.AG4]) -> 7
A5: 3 | B5: 11c_Pavarde_3 Vardas_3 | C5: 2 | F5: 5A | G5: 4A | O5: 4A | Q5: 5A | R5: 1B | T5: 2B | V5: 4 | Z5: 2B | AE5: 1 | AH5: of:=SUM([.C5:.AG5]) -> 7
A6: 4 | B6: 11c_Pavarde_4 Vardas_4 | C6: 2 | F6: 5A | G6: 5A | N6: 2B | O6: 4A | Q6: 5A | T6: 2B | X6: 4 | Z6: 2B | AC6: 1 | AH6: of:=SUM([.C6:.AG6]) -> 7
A7: 5 | B7: 11c_Pavarde_5 Vardas_4 | C7: 2 | F7: 6A | G7: 4A | L7: 2B | O7: 4A | Q7: 5A | R7: 1B | T7: 2B | Y7: 3 | Z7: 2B | AH7: of:=SUM([.C7:.AG7]) -> 5
A8: 6 | B8: 11c_Pavarde_6 Vardas_5 | C8: 2 | F8: 5A | G8: 5A | M8: 2B | O8: 3A | P8: 2B | Q8: 5A | R8: 2A | T8: 2B | Y8: 3 | Z8: 2B | AE8: 1 | AH8: of:=SUM([.C8:.AG8]) -> 6
A9: 7 | B9: 11c_Pavarde_7 Vardas_6 | C9: 2 | F9: 5A | G9: 3B | L9: 2B | O9: 3A | Q9: 5A | R9: 2A | T9: 2B | V9: 3 | Z9: 2B | AD9: 1 | AH9: of:=SUM([.C9:.AG9]) -> 6
A10: 8 | B10: 11c_Pavarde_8 Vardas_7 | C10: 2 | F10: 4B | G10: 4A | O10: 4A | Q10: 4A | R10: 2A | T10: 2B | X10: 3 | Z10: 2B | AD10: 1 | AH10: of:=SUM([.C10:.AG10]) -> 6
A11: 9 | B11: 11c_Pavarde_9 Vardas_8 | C11: 2 | F11: 5A | G11: 4A | O11: 3A | P11: 2B | Q11: 5A | T11: 2B | V11: 3 | Z11: 2B | AD11: 1 | AH11: of:=SUM([.C11:.AG11]) -> 6
A12: 10 | B12: 11c_Pavarde_10 Vardas_9 | C12: 2 | F12: 5A | G12: 3B | O12: 3A | P12: 3A | Q12: 5A | R12: 1B | T12: 2B | V12: 3 | Z12: 2B | AD12: 1 | AE12: 1 | AH12: of:=SUM([.C12:.AG12]) -> 7
A13: 11 | B13: 11c_Pavarde_11 Vardas_10 | C13: 2 | F13: 5A | G13: 4A | M13: 2B | O13: 4A | Q13: 6A | R13: 1B | T13: 2B | Y13: 3 | Z13: 2 | AD13: 1 | AH13: of:=SUM([.C13:.AG13]) -> 8
A14: 12 | B14: 11c_Pavarde_12 Vardas_11 | C14: 2 | F14: 5A | G14: 4A | M14: 2B | O14: 3A | P14: 2B | Q14: 5A | R14: 1B | T14: 2B | V14: 4 | Z14: 2B | AH14: of:=SUM([.C14:.AG14]) -> 6
A15: 13 | B15: 11c_Pavarde_13 Vardas_12 | C15: 2 | F15: 5A | G15: 4A | O15: 3A | Q15: 5A | R15: 1B | T15: 2B | V15: 4 | Z15: 2 | AD15: 1 | AH15: of:=SUM([.C15:.AG15]) -> 9
A16: 14 | B16: 11c_Pavarde_14 Vardas_13 | C16: 2 | F16: 5A | G16: 4A | M16: 2B | O16: 4A | Q16: 5A | R16: 2A | T16: 2B | X16: 3 | Z16: 2B | AD16: 1 | AH16: of:=SUM([.C16:.AG16]) -> 6
A17: 15 | B17: 11c_Pavarde_15 Vardas_14 | C17: 2 | F17: 6A | G17: 4A | L17: 2B | O17: 4A | Q17: 3B | R17: 1B | T17: 2B | X17: 4 | Z17: 2B | AH17: of:=SUM([.C17:.AG17]) -> 6
A18: 16 | B18: 11c_Pavarde_16 Vardas_15 | C18: 2 | F18: 5A | G18: 4A | O18: 3A | Q18: 5A | R18: 2A | T18: 2B | Y18: 4 | Z18: 2 | AE18: 1 | AH18: of:=SUM([.C18:.AG18]) -> 9
A19: 17 | B19: 11c_Pavarde_17 Vardas_16 | C19: 2 | F19: 6A | G19: 4A | L19: 2B | O19: 4A | Q19: 6A | R19: 1B | T19: 2B | Y19: 3 | Z19: 2B | AH19: of:=SUM([.C19:.AG19]) -> 5
A20: 18 | B20: 11c_Pavarde_18 Vardas_17 | C20: 2 | F20: 5A | G20: 4A | L20: 2B | O20: 4A | Q20: 4A | R20: 1B | T20: 2B | V20: 3 | Z20: 2B | AH20: of:=SUM([.C20:.AG20]) -> 5
A21: 19 | B21: 11c_Pavarde_19 Vardas_18 | C21: 2 | F21: 5A | G21: 4A | M21: 2B | O21: 4A | Q21: 5A | R21: 1B | T21: 2B | X21: 4 | Z21: 2B | AB21: 1 | AH21: of:=SUM([.C21:.AG21]) -> 7
A22: 20 | B22: 11c_Pavarde_20 Vardas_19 | C22: 2 | F22: 5A | G22: 5A | M22: 2B | O22: 4A | Q22: 5A | R22: 1B | T22: 2B | X22: 4 | Z22: 2B | AH22: of:=SUM([.C22:.AG22]) -> 6
A23: 21 | B23: 11c_Pavarde_21 Vardas_20 | C23: 2 | F23: 5A | G23: 4A | M23: 2B | O23: 4A | Q23: 5A | R23: 1B | T23: 2B | V23: 3 | Z23: 2B | AC23: 1 | AH23: of:=SUM([.C23:.AG23]) -> 6
A24: 22 | B24: 11c_Pavarde_22 Vardas_21 | C24: 2 | F24: 5A | G24: 4A | O24: 4A | Q24: 5A | R24: 1B | T24: 2B | X24: 4 | Z24: 2B | AE24: 1 | AH24: of:=SUM([.C24:.AG24]) -> 7
A25: 23 | B25: 11c_Pavarde_23 Vardas_21 | C25: 2 | F25: 6A | G25: 5A | L25: 2B | O25: 4A | Q25: 5A | R25: 1B | T25: 2B | Y25: 3 | Z25: 2B | AH25: of:=SUM([.C25:.AG25]) -> 5
A26: 24 | B26: 11c_Pavarde_24 Vardas_22 | C26: 2 | F26: 5A | G26: 3B | O26: 3A | Q26: 5A | R26: 2A | T26: 2B | Y26: 3 | Z26: 2B | AE26: 1 | AH26: of:=SUM([.C26:.AG26]) -> 6
A27: 25 | B27: 11c_Pavarde_25 Vardas_22 | C27: 2 | F27: 5A | G27: 4A | L27: 2 | O27: 3A | P27: 2B | Q27: 5A | R27: 1B | T27: 2B | W27: 4 | Z27: 2 | AH27: of:=SUM([.C27:.AG27]) -> 10
A28: 26 | B28: 11c_Pavarde_26 Vardas_23 | C28: 2 | F28: 6A | G28: 4A | O28: 4A | Q28: 5A | R28: 1B | T28: 2B | X28: 4 | Z28: 2 | AE28: 1 | AH28: of:=SUM([.C28:.AG28]) -> 9
A29: 27 | B29: 11c_Pavarde_27 Vardas_23 | C29: 2 | F29: 4B | G29: 4A | O29: 4A | Q29: 5A | R29: 2A | T29: 2B | X29: 4 | Z29: 2B | AD29: 1 | AE29: 1 | AH29: of:=SUM([.C29:.AG29]) -> 8
A30: 28 | B30: 11c_Pavarde_28 Vardas_24 | C30: 2 | F30: 6A | G30: 4A | L30: 2B | O30: 4A | Q30: 5A | R30: 1B | T30: 2B | X30: 3 | Z30: 2B | AH30: of:=SUM([.C30:.AG30]) -> 5
A31: 29 | B31: 11c_Pavarde_29 Vardas_25 | C31: 2 | F31: 5A | G31: 4A | O31: 4A | Q31: 5A | R31: 1B | T31: 2B | X31: 4 | Z31: 2B | AE31: 1 | AH31: of:=SUM([.C31:.AG31]) -> 7

Sheet: 11d
A1: Eil. | B1: Pavarde Vardas | C1: Dor. ugd. | F1: Leit.k. | G1: 1 užs.kalba | K1: 2 užs.kalba | O1: Ist | P1: Geo | Q1: Mat | R1: Inf | S1: Biol | T1: Fiz | U1: Chem | V1: Menai | Z1: KK | AA1: Pasirenkami | AH1: Viso
A2: Ps | B2: T | C2: E | E2: A1 | F2: V1 | G2: R1 | H2: Pr1 | I2: A2 | J2: V2 | K2: R2 | L2: Pr2 | T2: D | U2: M | V2: Te | W2: S | X2: lot | Y2: isp | Z2: gp | AA2: br | AB2: ek | AC2: pb | AD2: PC
A3: 1 | B3: 11d_Pavarde_1 Vardas_1 | E3: 2 | F3: 6A | G3: 3B | M3: 2B | O3: 3A | Q3: 4B | R3: 1B | S3: 3A | V3: 3 | Z3: 2 | AB3: 1 | AH3: of:=SUM([.C3:.AG3]) -> 8
A4: 2 | B4: 11d_Pavarde_2 Vardas_2 | C4: 2 | F4: 5A | G4: 4A | O4: 2B | P4: 2B | Q4: 3B | R4: 2B | S4: 3A | W4: 3 | Z4: 2B | AH4: of:=SUM([.C4:.AG4]) -> 5
A5: 3 | B5: 11d_Pavarde_3 Vardas_3 | E5: 2 | F5: 5A | G5: 4A | O5: 3A | P5: 2B | Q5: 5A | R5: 2A | T5: 3A | X5: 3 | Z5: 2B | AE5: 1 | AH5: of:=SUM([.C5:.AG5]) -> 6
A6: 4 | B6: 11d_Pavarde_4 Vardas_4 | C6: 2 | F6: 5A | G6: 4A | L6: 2 | O6: 4A | Q6: 5A | R6: 1B | T6: 3A | X6: 4 | Z6: 2 | AH6: of:=SUM([.C6:.AG6]) -> 10
A7: 5 | B7: 11d_Pavarde_5 Vardas_4 | C7: 2 | F7: 5A | G7: 4A | L7: 2B | O7: 3A | Q7: 5A | R7: 2A | T7: 3A | X7: 3 | Z7: 2B | AD7: 1 | AH7: of:=SUM([.C7:.AG7]) -> 6
A8: 6 | B8: 11d_Pavarde_6 Vardas_5 | C8: 2 | F8: 5A | G8: 4A | O8: 3A | Q8: 5A | S8: 3A | V8: 4 | Z8: 2 | AE8: 1 | AH8: of:=SUM([.C8:.AG8]) -> 9
A9: 7 | B9: 11d_Pavarde_7 Vardas_6 | C9: 2 | F9: 5A | G9: 4A | O9: 4A | Q9: 5A | R9: 2A | T9: 3A | Y9: 4 | Z9: 2 | AD9: 1 | AH9: of:=SUM([.C9:.AG9]) -> 9
A10: 8 | B10: 11d_Pavarde_8 Vardas_7 | C10: 2 | F10: 5A | G10: 5A | L10: 2B | O10: 3A | Q10: 5A | R10: 2A | S10: 3A | W10: 3 | Z10: 2B | AH10: of:=SUM([.C10:.AG10]) -> 5
A11: 9 | B11: 11d_Pavarde_9 Vardas_8 | D11: 2 | F11: 5A | G11: 4A | O11: 2B | P11: 2B | Q11: 4B | R11: 1B | S11: 4A | W11: 3 | Z11: 2 | AH11: of:=SUM([.C11:.AG11]) -> 7
A12: 10 | B12: 11d_Pavarde_10 Vardas_9 | C12: 2 | F12: 5A | G12: 4A | O12: 2B | Q12: 5A | R12: 1B | S12: 3A | Y12: 3 | Z12: 2B | AD12: 1 | AH12: of:=SUM([.C12:.AG12]) -> 6
A13: 11 | B13: 11d_Pavarde_11 Vardas_10 | C13: 2 | F13: 5A | G13: 4A | P13: 2B | Q13: 5A | R13: 1B | T13: 3A | U13: 2B | V13: 3 | Z13: 2 | AD13: 1 | AH13: of:=SUM([.C13:.AG13]) -> 8
A14: 12 | B14: 11d_Pavarde_12 Vardas_11 | C14: 2 | F14: 5A | G14: 4A | O14: 2B | P14: 3A | Q14: 6A | R14: 1B | T14: 3A | Y14: 3 | Z14: 2 | AD14: 1 | AH14: of:=SUM([.C14:.AG14]) -> 8
A15: 13 | B15: 11d_Pavarde_13 Vardas_12 | C15: 2 | F15: 5A | G15: 4A | P15: 2B | Q15: 6A | R15: 2A | T15: 3A | W15: 3 | Z15: 2B | AH15: of:=SUM([.C15:.AG15]) -> 5
A16: 14 | B16: 11d_Pavarde_14 Vardas_13 | C16: 2 | F16: 5A | G16: 4A | O16: 2B | Q16: 5A | R16: 2A | T16: 4A | Y16: 4 | Z16: 2 | AD16: 1 | AH16: of:=SUM([.C16:.AG16]) -> 9
A17: 15 | B17: 11d_Pavarde_15 Vardas_14 | C17: 2 | F17: 5A | G17: 4A | O17: 2B | Q17: 5A | R17: 2A | T17: 4A | U17: 2B | Y17: 3 | Z17: 2 | AD17: 1 | AH17: of:=SUM([.C17:.AG17]) -> 8
A18: 16 | B18: 11d_Pavarde_16 Vardas_15 | E18: 2 | F18: 5A | G18: 3B | M18: 2B | O18: 2B | P18: 3A | Q18: 4B | R18: 1B | S18: 3A | Y18: 3 | Z18: 2B | AH18: of:=SUM([.C18:.AG18]) -> 5
A19: 17 | B19: 11d_Pavarde_17 Vardas_16 | C19: 2 | F19: 5A | G19: 4A | L19: 2 | O19: 4A | Q19: 5A | R19: 1B | T19: 3A | Y19: 4 | Z19: 2 | AH19: of:=SUM([.C19:.AG19]) -> 10
A20: 18 | B20: 11d_Pavarde_18 Vardas_17 | C20: 2 | F20: 4A | G20: 4A | L20: 2 | P20: 2B | Q20: 5A | R20: 2A | T20: 3A | W20: 4 | Z20: 2 | AD20: 1 | AH20: of:=SUM([.C20:.AG20]) -> 11
A21: 19 | B21: 11d_Pavarde_19 Vardas_18 | C21: 2 | F21: 4A | G21: 3B | L21: 2B | O21: 2B | P21: 3A | Q21: 4B | R21: 1B | S21: 3A | Y21: 3 | Z21: 2B | AH21: of:=SUM([.C21:.AG21]) -> 5
A22: 20 | B22: 11d_Pavarde_20 Vardas_19 | C22: 2 | F22: 5A | G22: 4A | M22: 2B | O22: 3A | Q22: 5A | R22: 2A | T22: 3A | X22: 4 | Z22: 2B | AH22: of:=SUM([.C22:.AG22]) -> 6
A23: 21 | B23: 11d_Pavarde_21 Vardas_20 | D23: 2 | F23: 5A | G23: 5A | L23: 2B | O23: 2B | Q23: 5A | R23: 2A | T23: 3A | W23: 3 | Z23: 2B | AH23: of:=SUM([.C23:.AG23]) -> 5
A24: 22 | B24: 11d_Pavarde_22 Vardas_21 | C24: 2 | F24: 5A | G24: 5A | O24: 3A | Q24: 5A | R24: 2A | T24: 3A | W24: 4 | Z24: 2B | AD24: 1 | AE24: 1 | AH24: of:=SUM([.C24:.AG24]) -> 8
A25: 23 | B25: 11d_Pavarde_23 Vardas_21 | C25: 2 | F25: 5A | G25: 5A | O25: 4A | P25: 2B | Q25: 3B | R25: 1B | S25: 3A | Y25: 3 | Z25: 2B | AE25: 1 | AH25: of:=SUM([.C25:.AG25]) -> 6
A26: 24 | B26: 11d_Pavarde_24 Vardas_22 | C26: 2 | F26: 6A | G26: 6A | M26: 2B | O26: 3A | P26: 2B | Q26: 5A | S26: 3A | V26: 3 | Z26: 2B | AH26: of:=SUM([.C26:.AG26]) -> 5
A27: 25 | B27: 11d_Pavarde_25 Vardas_22 | E27: 2 | F27: 5A | G27: 5A | M27: 2B | O27: 2B | P27: 3A | Q27: 6A | T27: 3A | X27: 3 | Z27: 2B | AH27: of:=SUM([.C27:.AG27]) -> 5
A28: 26 | B28: 11d_Pavarde_26 Vardas_23 | E28: 2 | F28: 5A | G28: 4A | M28: 2B | O28: 2B | Q28: 5A | T28: 4A | X28: 4 | Z28: 2B | AD28: 1 | AH28: of:=SUM([.C28:.AG28]) -> 7
A29: 27 | B29: 11d_Pavarde_27 Vardas_23 | C29: 2 | F29: 5A | G29: 4A | O29: 2B | Q29: 5A | R29: 1B | T29: 3A | Y29: 3 | Z29: 2 | AH29: of:=SUM([.C29:.AG29]) -> 7
A30: 28 | B30: 11d_Pavarde_28 Vardas_24 | C30: 2 | F30: 5A | G30: 4A | L30: 2B | O30: 3A | Q30: 5A | S30: 3A | X30: 3 | Z30: 2B | AH30: of:=SUM([.C30:.AG30]) -> 5
A31: 29 | B31: 11d_Pavarde_29 Vardas_25 | C31: 2 | F31: 5A | G31: 3B | O31: 2B | P31: 2B | Q31: 5A | R31: 1B | T31: 4A | Y31: 3 | Z31: 2B | AD31: 1 | AH31: of:=SUM([.C31:.AG31]) -> 6
A32: 30 | B32: 11d_Pavarde_30 Vardas_26 | C32: 2 | F32: 5A | G32: 4A | O32: 2B | Q32: 5A | R32: 3A | T32: 3A | V32: 4 | Z32: 2 | AD32: 1 | AH32: of:=SUM([.C32:.AG32]) -> 9

Sheet: 11e
A1: Eil. | B1: Pavarde Vardas | C1: Dor. ugd. | F1: Leit.k. | G1: 1 užs.kalba | K1: 2 užs.kalba | O1: Ist | P1: Geo | Q1: Mat | R1: Inf | S1: Biol | T1: Fiz | U1: Chem | V1: Menai | Z1: KK | AA1: Pasirenkami | AH1: Viso
A2: Ps | B2: T | C2: E | E2: A1 | F2: V1 | G2: R1 | H2: Pr1 | I2: A2 | J2: V2 | K2: R2 | L2: Pr2 | T2: D | U2: M | V2: Te | W2: S | X2: lot | Y2: isp | Z2: gp | AA2: br | AB2: ek | AC2: pb | AD2: PC
A3: 1 | B3: 11e_Pavarde_1 Vardas_1 | C3: 2 | F3: 5A | G3: 4A | O3: 2B | Q3: 5A | R3: 2A | T3: 3A | U3: 2B | V3: 3 | Z3: 2B | AH3: of:=SUM([.C3:.AG3]) -> 5
A4: 2 | B4: 11e_Pavarde_2 Vardas_2 | C4: 2 | F4: 5A | G4: 4A | O4: 3A | Q4: 5A | R4: 1B | T4: 4A | U4: 2B | X4: 4 | Z4: 2B | AH4: of:=SUM([.C4:.AG4]) -> 6
A5: 3 | B5: 11e_Pavarde_3 Vardas_3 | C5: 2 | F5: 5A | G5: 4A | O5: 3A | Q5: 5A | R5: 2A | T5: 3A | W5: 3 | Z5: 2B | AD5: 1 | AH5: of:=SUM([.C5:.AG5]) -> 6
A6: 4 | B6: 11e_Pavarde_4 Vardas_4 | C6: 2 | F6: 5A | G6: 4A | O6: 2B | Q6: 5A | R6: 2A | T6: 3A | U6: 2B | W6: 3 | Z6: 2B | AD6: 1 | AH6: of:=SUM([.C6:.AG6]) -> 6
A7: 5 | B7: 11e_Pavarde_5 Vardas_4 | E7: 2 | F7: 5A | G7: 4A | O7: 3A | P7: 2B | Q7: 3B | S7: 3A | V7: 3 | Z7: 2B | AD7: 1 | AH7: of:=SUM([.C7:.AG7]) -> 6
A8: 6 | B8: 11e_Pavarde_6 Vardas_5 | E8: 2 | F8: 5A | G8: 4A | O8: 2B | Q8: 5A | R8: 2A | T8: 3A | U8: 2B | X8: 3 | Z8: 2B | AD8: 1 | AH8: of:=SUM([.C8:.AG8]) -> 6
A9: 7 | B9: 11e_Pavarde_7 Vardas_6 | C9: 2 | F9: 5A | G9: 4A | O9: 2B | Q9: 5A | R9: 2A | T9: 4A | U9: 2B | W9: 3 | Z9: 2B | AD9: 1 | AH9: of:=SUM([.C9:.AG9]) -> 6
A10: 8 | B10: 11e_Pavarde_8 Vardas_7 | C10: 2 | F10: 4A | G10: 4A | O10: 2B | P10: 2B | Q10: 5A | R10: 1B | S10: 3A | U10: 2B | V10: 3 | Z10: 2B | AH10: of:=SUM([.C10:.AG10]) -> 5
A11: 9 | B11: 11e_Pavarde_9 Vardas_8 | C11: 2 | F11: 5A | G11: 4A | P11: 2B | Q11: 5A | R11: 1B | T11: 4A | U11: 2B | Y11: 4 | Z11: 2B | AD11: 1 | AH11: of:=SUM([.C11:.AG11]) -> 7
A12: 10 | B12: 11e_Pavarde_10 Vardas_9 | E12: 2 | F12: 5A | G12: 4A | O12: 2B | Q12: 5A | R12: 2A | T12: 4A | U12: 2B | X12: 3 | Z12: 2B | AH12: of:=SUM([.C12:.AG12]) -> 5
A13: 11 | B13: 11e_Pavarde_11 Vardas_10 | C13: 2 | F13: 5A | G13: 4A | O13: 2B | Q13: 5A | R13: 1B | T13: 4A | U13: 2B | X13: 3 | Z13: 2B | AD13: 1 | AH13: of:=SUM([.C13:.AG13]) -> 6
A14: 12 | B14: 11e_Pavarde_12 Vardas_11 | C14: 2 | F14: 5A | G14: 4A | O14: 2B | Q14: 5A | R14: 2A | T14: 3A | U14: 2B | W14: 3 | Z14: 2B | AD14: 1 | AH14: of:=SUM([.C14:.AG14]) -> 6
A15: 13 | B15: 11e_Pavarde_13 Vardas_12 | C15: 2 | F15: 5A | G15: 4A | L15: 2B | O15: 3A | Q15: 5A | S15: 3A | U15: 2B | X15: 3 | Z15: 2B | AD15: 1 | AH15: of:=SUM([.C15:.AG15]) -> 6
A16: 14 | B16: 11e_Pavarde_14 Vardas_13 | C16: 2 | F16: 5A | G16: 4A | O16: 2B | Q16: 5A | R16: 2A | T16: 3A | U16: 2B | Y16: 4 | Z16: 2 | AD16: 1 | AH16: of:=SUM([.C16:.AG16]) -> 9
A17: 15 | B17: 11e_Pavarde_15 Vardas_14 | E17: 2 | F17: 5A | G17: 4A | O17: 2B | Q17: 5A | R17: 1B | T17: 3A | U17: 2B | X17: 3 | Z17: 2B | AD17: 1 | AH17: of:=SUM([.C17:.AG17]) -> 6
A18: 16 | B18: 11e_Pavarde_16 Vardas_15 | C18: 2 | F18: 5A | G18: 4A | O18: 2B | P18: 2B | Q18: 5A | R18: 1B | S18: 3A | U18: 2B | W18: 3 | Z18: 2B | AH18: of:=SUM([.C18:.AG18]) -> 5
A19: 17 | B19: 11e_Pavarde_17 Vardas_16 | E19: 2 | F19: 5A | G19: 4A | O19: 2B | Q19: 5A | R19: 2A | S19: 3A | U19: 2B | W19: 3 | Z19: 2B | AH19: of:=SUM([.C19:.AG19]) -> 5
A20: 18 | B20: 11e_Pavarde_18 Vardas_17 | C20: 2 | F20: 5A | G20: 4A | M20: 2B | O20: 3A | P20: 2B | Q20: 3B | S20: 3A | U20: 2B | X20: 3 | Z20: 2B | AB20: 1 | AH20: of:=SUM([.C20:.AG20]) -> 6
A21: 19 | B21: 11e_Pavarde_19 Vardas_18 | C21: 2 | F21: 5A | G21: 4A | M21: 2B | O21: 3A | Q21: 5A | R21: 1B | T21: 3A | U21: 2B | W21: 4 | Z21: 2B | AH21: of:=SUM([.C21:.AG21]) -> 6
A22: 20 | B22: 11e_Pavarde_20 Vardas_19 | E22: 2 | F22: 5A | G22: 4A | O22: 3A | Q22: 5A | R22: 1B | T22: 4A | U22: 2B | X22: 3 | Z22: 2B | AD22: 1 | AH22: of:=SUM([.C22:.AG22]) -> 6
A23: 21 | B23: 11e_Pavarde_21 Vardas_20 | C23: 2 | F23: 5A | G23: 4A | P23: 2B | Q23: 5A | R23: 2A | T23: 4A | U23: 2B | V23: 3 | Z23: 2B | AD23: 1 | AH23: of:=SUM([.C23:.AG23]) -> 6
A24: 22 | B24: 11e_Pavarde_22 Vardas_21 | C24: 2 | F24: 5A | G24: 4A | O24: 3A | Q24: 4B | R24: 1B | S24: 3A | W24: 3 | Z24: 2B | AB24: 1 | AH24: of:=SUM([.C24:.AG24]) -> 6

Sheet: 11f
A1: Eil. | B1: Pavarde Vardas | C1: Dor. ugd. | F1: Leit.k. | G1: 1 užs.kalba | K1: 2 užs.kalba | O1: Ist | P1: Geo | Q1: Mat | R1: Inf | S1: Biol | T1: Fiz | U1: Chem | V1: Menai | Z1: KK | AA1: Pasirenkami | AH1: Viso
A2: Ps | B2: T | C2: E | E2: A1 | F2: V1 | G2: R1 | H2: Pr1 | I2: A2 | J2: V2 | K2: R2 | L2: Pr2 | T2: D | U2: M | V2: Te | W2: S | X2: lot | Y2: isp | Z2: gp | AA2: br | AB2: ek | AC2: pb | AD2: PC
A3: 1 | B3: 11f_Pavarde_1 Vardas_1 | C3: 2 | F3: 5A | G3: 4A | M3: 2B | O3: 3B | Q3: 5A | S3: 3A | U3: 3A | X3: 3 | Z3: 2B | AH3: of:=SUM([.C3:.AG3]) -> 5
A4: 2 | B4: 11f_Pavarde_2 Vardas_2 | E4: 2 | F4: 5A | G4: 4A | O4: 2B | Q4: 5A | R4: 1B | S4: 3A | U4: 3A | V4: 3 | Z4: 2 | AH4: of:=SUM([.C4:.AG4]) -> 7
A5: 3 | B5: 11f_Pavarde_3 Vardas_3 | C5: 2 | F5: 5A | G5: 4A | O5: 3B | Q5: 5A | S5: 4A | U5: 3A | X5: 3 | Z5: 2B | AH5: of:=SUM([.C5:.AG5]) -> 5
A6: 4 | B6: 11f_Pavarde_4 Vardas_4 | C6: 2 | F6: 5A | G6: 5A | O6: 2B | Q6: 5A | S6: 3A | U6: 3A | X6: 4 | Z6: 2B | AH6: of:=SUM([.C6:.AG6]) -> 6
A7: 5 | B7: 11f_Pavarde_5 Vardas_4 | C7: 2 | F7: 5A | G7: 4A | O7: 3B | Q7: 5A | R7: 1B | S7: 3A | T7: 3A | Y7: 3 | Z7: 2B | AD7: 1 | AH7: of:=SUM([.C7:.AG7]) -> 6
A8: 6 | B8: 11f_Pavarde_6 Vardas_5 | C8: 2 | F8: 5A | G8: 4A | L8: 2B | O8: 2B | Q8: 5A | S8: 3A | U8: 3A | Y8: 3 | Z8: 2B | AB8: 1 | AH8: of:=SUM([.C8:.AG8]) -> 6
A9: 7 | B9: 11f_Pavarde_7 Vardas_6 | C9: 2 | F9: 5A | G9: 4A | O9: 3B | Q9: 5A | R9: 1B | S9: 3A | U9: 3A | Y9: 3 | Z9: 2B | AA9: 1 | AH9: of:=SUM([.C9:.AG9]) -> 6
A10: 8 | B10: 11f_Pavarde_8 Vardas_7 | C10: 2 | F10: 6A | G10: 4A | O10: 2B | Q10: 5A | S10: 3A | U10: 3A | Y10: 3 | Z10: 2B | AA10: 1 | AH10: of:=SUM([.C10:.AG10]) -> 6
A11: 9 | B11: 11f_Pavarde_9 Vardas_8 | E11: 2 | F11: 5A | G11: 4A | M11: 2B | O11: 3B | Q11: 4B | S11: 3A | U11: 3A | W11: 3 | Z11: 2B | AA11: 1 | AH11: of:=SUM([.C11:.AG11]) -> 6
A12: 10 | B12: 11f_Pavarde_10 Vardas_9 | C12: 2 | F12: 5A | G12: 3B | O12: 2B | Q12: 5A | S12: 4A | U12: 3A | Y12: 4 | Z12: 2 | AA12: 1 | AF12: 1 | AH12: of:=SUM([.C12:.AG12]) -> 10
A13: 11 | B13: 11f_Pavarde_11 Vardas_10 | E13: 2 | F13: 5A | G13: 4A | O13: 2B | P13: 2B | Q13: 5A | S13: 4A | U13: 3A | X13: 3 | Z13: 2B | AH13: of:=SUM([.C13:.AG13]) -> 5
A14: 12 | B14: 11f_Pavarde_12 Vardas_11 | E14: 2 | F14: 5A | G14: 4A | O14: 3B | Q14: 5A | S14: 2B | T14: 3A | U14: 2B | X14: 3 | Z14: 2B | AH14: of:=SUM([.C14:.AG14]) -> 5
A15: 13 | B15: 11f_Pavarde_13 Vardas_12 | C15: 2 | F15: 5A | G15: 4A | O15: 3B | Q15: 5A | R15: 1B | S15: 3A | U15: 3A | W15: 3 | Z15: 2B | AH15: of:=SUM([.C15:.AG15]) -> 5
A16: 14 | B16: 11f_Pavarde_14 Vardas_13 | C16: 2 | F16: 5A | G16: 4A | O16: 3B | Q16: 5A | R16: 2A | S16: 2B | U16: 2B | Y16: 3 | Z16: 2B | AD16: 1 | AE16: 1 | AH16: of:=SUM([.C16:.AG16]) -> 7
A17: 15 | B17: 11f_Pavarde_15 Vardas_14 | C17: 2 | F17: 5A | G17: 4A | M17: 2B | O17: 3B | Q17: 5A | S17: 3A | U17: 3A | X17: 3 | Z17: 2B | AH17: of:=SUM([.C17:.AG17]) -> 5
A18: 16 | B18: 11f_Pavarde_16 Vardas_15 | C18: 2 | F18: 5A | G18: 4A | P18: 2B | Q18: 6A | R18: 2A | S18: 2B | T18: 4A | W18: 3 | Z18: 2B | AH18: of:=SUM([.C18:.AG18]) -> 5
A19: 17 | B19: 11f_Pavarde_17 Vardas_16 | C19: 2 | F19: 5A | G19: 4A | O19: 2B | Q19: 5A | S19: 3A | U19: 3A | Y19: 3 | Z19: 2B | AH19: of:=SUM([.C19:.AG19]) -> 5
A20: 18 | B20: 11f_Pavarde_18 Vardas_17 | C20: 2 | F20: 6A | G20: 4A | O20: 2B | Q20: 5A | S20: 3A | U20: 4A | V20: 3 | Z20: 2B | AG20: 1 | AH20: of:=SUM([.C20:.AG20]) -> 6
A21: 19 | B21: 11f_Pavarde_19 Vardas_18 | C21: 2 | F21: 5A | G21: 4A | O21: 2B | Q21: 5A | S21: 3A | T21: 3A | U21: 3A | Y21: 3 | Z21: 2 | AH21: of:=SUM([.C21:.AG21]) -> 7
A22: 20 | B22: 11f_Pavarde_20 Vardas_19 | C22: 2 | F22: 5A | G22: 4A | M22: 2B | O22: 3B | Q22: 5A | R22: 1B | U22: 3A | Y22: 4 | Z22: 2B | AH22: of:=SUM([.C22:.AG22]) -> 6
A23: 21 | B23: 11f_Pavarde_21 Vardas_20 | C23: 2 | F23: 5A | G23: 4A | M23: 2B | O23: 2B | Q23: 5A | S23: 3A | U23: 3A | W23: 3 | Z23: 2B | AB23: 1 | AH23: of:=SUM([.C23:.AG23]) -> 6
A24: 22 | B24: 11f_Pavarde_22 Vardas_21 | C24: 2 | F24: 5A | G24: 4A | O24: 2B | Q24: 3B | S24: 3A | U24: 3A | Y24: 3 | Z24: 2B | AA24: 1 | AB24: 1 | AH24: of:=SUM([.C24:.AG24]) -> 7
A25: 23 | B25: 11f_Pavarde_23 Vardas_21 | C25: 2 | F25: 5A | G25: 4A | M25: 2B | O25: 2B | Q25: 5A | R25: 1B | S25: 2B | T25: 3A | U25: 2B | X25: 3 | Z25: 2B | AH25: of:=SUM([.C25:.AG25]) -> 5
A26: 24 | B26: 11f_Pavarde_24 Vardas_22 | E26: 2 | F26: 5A | G26: 4A | N26: 2B | O26: 3B | Q26: 5A | S26: 2B | U26: 2B | V26: 3 | Z26: 2B | AH26: of:=SUM([.C26:.AG26]) -> 5
A27: 25 | B27: 11f_Pavarde_25 Vardas_22 | E27: 2 | F27: 5A | G27: 4A | O27: 2B | Q27: 5A | R27: 2A | S27: 3A | T27: 4A | X27: 3 | Z27: 2B | AH27: of:=SUM([.C27:.AG27]) -> 5
A28: 26 | B28: 11f_Pavarde_26 Vardas_23 | C28: 2 | F28: 5A | G28: 4A | O28: 2B | Q28: 5A | S28: 3A | U28: 3A | V28: 3 | Z28: 2B | AH28: of:=SUM([.C28:.AG28]) -> 5

Sheet: 11g
A1: Eil. | B1: Pavarde Vardas | C1: Dor. ugd. | F1: Leit.k. | G1: 1 užs.kalba | K1: 2 užs.kalba | O1: Ist | P1: Geo | Q1: Mat | R1: Inf | S1: Biol | T1: Fiz | U1: Chem | V1: Menai | Z1: KK | AA1: Pasirenkami | AH1: Viso
A2: Ps | B2: T | C2: E | E2: A1 | F2: V1 | G2: R1 | H2: Pr1 | I2: A2 | J2: V2 | K2: R2 | L2: Pr2 | T2: D | U2: M | V2: Te | W2: S | X2: lot | Y2: isp | Z2: gp | AA2: br | AB2: ek | AC2: pb | AD2: PC
A3: 1 | B3: 11g_Pavarde_1 Vardas_1 | C3: 2 | F3: 5A | G3: 4A | O3: 2B | Q3: 5A | R3: 2A | S3: 2B | T3: 2B | V3: 3 | Z3: 2B | AD3: 1 | AE3: 1 | AH3: of:=SUM([.C3:.AG3]) -> 7
A4: 2 | B4: 11g_Pavarde_2 Vardas_2 | E4: 2 | F4: 5A | G4: 4A | O4: 2B | P4: 3A | Q4: 3B | R4: 1B | S4: 3A | T4: 2B | W4: 3 | Z4: 2B | AH4: of:=SUM([.C4:.AG4]) -> 5
A5: 3 | B5: 11g_Pavarde_3 Vardas_3 | C5: 2 | F5: 5A | G5: 3B | O5: 3A | P5: 2A | Q5: 5A | R5: 1B | S5: 2B | T5: 2B | Y5: 3 | Z5: 2B | AD5: 1 | AH5: of:=SUM([.C5:.AG5]) -> 6
A6: 4 | B6: 11g_Pavarde_4 Vardas_4 | C6: 2 | F6: 5A | G6: 4A | O6: 2B | Q6: 5A | S6: 3A | T6: 2B | U6: 3A | Y6: 3 | Z6: 2B | AA6: 1 | AH6: of:=SUM([.C6:.AG6]) -> 6
A7: 5 | B7: 11g_Pavarde_5 Vardas_4 | C7: 2 | F7: 5A | G7: 3B | O7: 2B | P7: 2A | Q7: 5A | R7: 2A | S7: 2B | T7: 2B | V7: 3 | Z7: 2B | AD7: 1 | AH7: of:=SUM([.C7:.AG7]) -> 6
A8: 6 | B8: 11g_Pavarde_6 Vardas_5 | E8: 2 | F8: 5A | G8: 4A | O8: 3A | Q8: 5A | R8: 1B | S8: 2B | T8: 2B | U8: 3A | W8: 3 | Z8: 2B | AH8: of:=SUM([.C8:.AG8]) -> 5
A9: 7 | B9: 11g_Pavarde_7 Vardas_6 | E9: 2 | F9: 5A | G9: 4A | O9: 3A | Q9: 5A | S9: 3A | T9: 2B | W9: 3 | Z9: 2B | AA9: 1 | AH9: of:=SUM([.C9:.AG9]) -> 6
A10: 8 | B10: 11g_Pavarde_8 Vardas_7 | C10: 2 | F10: 5A | G10: 4A | O10: 2B | Q10: 5A | S10: 3A | T10: 2B | U10: 3A | X10: 3 | Z10: 2B | AA10: 1 | AH10: of:=SUM([.C10:.AG10]) -> 6
A11: 9 | B11: 11g_Pavarde_9 Vardas_8 | C11: 2 | F11: 5A | G11: 4A | O11: 2B | Q11: 5A | S11: 3A | T11: 2B | U11: 3A | Y11: 3 | Z11: 2B | AA11: 1 | AH11: of:=SUM([.C11:.AG11]) -> 6
A12: 10 | B12: 11g_Pavarde_10 Vardas_9 | C12: 2 | F12: 5A | G12: 4A | O12: 3A | P12: 3A | Q12: 5A | S12: 2B | T12: 2B | X12: 3 | Z12: 2B | AC12: 1 | AH12: of:=SUM([.C12:.AG12]) -> 6
A13: 11 | B13: 11g_Pavarde_11 Vardas_10 | C13: 2 | F13: 5A | G13: 4A | O13: 3A | Q13: 3B | R13: 1B | S13: 2B | T13: 2B | X13: 4 | Z13: 2B | AA13: 1 | AH13: of:=SUM([.C13:.AG13]) -> 7
A14: 12 | B14: 11g_Pavarde_12 Vardas_11 | C14: 2 | F14: 5A | G14: 4A | O14: 3A | P14: 2A | Q14: 5A | S14: 3A | T14: 2B | V14: 3 | Z14: 2B | AA14: 1 | AH14: of:=SUM([.C14:.AG14]) -> 6
A15: 13 | B15: 11g_Pavarde_13 Vardas_12 | C15: 2 | F15: 5A | G15: 4A | O15: 2B | Q15: 5A | S15: 3A | T15: 2B | U15: 3A | V15: 3 | Z15: 2B | AA15: 1 | AH15: of:=SUM([.C15:.AG15]) -> 6
A16: 14 | B16: 11g_Pavarde_14 Vardas_13 | C16: 2 | F16: 5A | G16: 4A | O16: 2B | Q16: 5A | R16: 1B | S16: 3A | T16: 2B | U16: 3A | X16: 3 | Z16: 2B | AH16: of:=SUM([.C16:.AG16]) -> 5
A17: 15 | B17: 11g_Pavarde_15 Vardas_14 | C17: 2 | F17: 5A | G17: 4A | O17: 3A | Q17: 5A | R17: 2A | T17: 2B | U17: 3A | Y17: 3 | Z17: 2B | AH17: of:=SUM([.C17:.AG17]) -> 5
A18: 16 | B18: 11g_Pavarde_16 Vardas_15 | C18: 2 | F18: 5A | G18: 4A | O18: 2B | Q18: 5A | R18: 1B | S18: 3A | T18: 2B | U18: 3A | Y18: 3 | Z18: 2B | AH18: of:=SUM([.C18:.AG18]) -> 5
A19: 17 | B19: 11g_Pavarde_17 Vardas_16 | C19: 2 | F19: 5A | G19: 4A | O19: 2B | Q19: 4A | R19: 1B | S19: 3A | T19: 2B | U19: 3A | X19: 3 | Z19: 2B | AA19: 1 | AH19: of:=SUM([.C19:.AG19]) -> 6
A20: 18 | B20: 11g_Pavarde_18 Vardas_17 | C20: 2 | F20: 5A | G20: 3B | O20: 3A | P20: 2A | Q20: 4A | R20: 1B | S20: 3A | T20: 2B | W20: 3 | Z20: 2B | AH20: of:=SUM([.C20:.AG20]) -> 5
A21: 19 | B21: 11g_Pavarde_19 Vardas_18 | E21: 2 | F21: 5A | G21: 4A | O21: 2B | P21: 3A | Q21: 5A | S21: 3A | T21: 2B | W21: 3 | Z21: 2B | AH21: of:=SUM([.C21:.AG21]) -> 5
A22: 20 | B22: 11g_Pavarde_20 Vardas_19 | C22: 2 | F22: 5A | G22: 4A | O22: 3A | Q22: 5A | S22: 3A | T22: 2B | U22: 3A | Y22: 3 | Z22: 2B | AH22: of:=SUM([.C22:.AG22]) -> 5
A23: 21 | B23: 11g_Pavarde_21 Vardas_20 | C23: 2 | F23: 5A | G23: 4A | O23: 3A | Q23: 3B | R23: 1B | S23: 3A | T23: 2B | X23: 3 | Z23: 2B | AH23: of:=SUM([.C23:.AG23]) -> 5
A24: 22 | B24: 11g_Pavarde_22 Vardas_21 | C24: 2 | F24: 5A | G24: 4A | O24: 2B | Q24: 5A | S24: 3A | T24: 2B | U24: 3A | Y24: 3 | Z24: 2B | AA24: 1 | AH24: of:=SUM([.C24:.AG24]) -> 6
A25: 23 | B25: 11g_Pavarde_23 Vardas_21 | C25: 2 | F25: 5A | G25: 4A | O25: 4A | P25: 3A | Q25: 3B | S25: 3A | T25: 2B | W25: 3 | Z25: 2B | AH25: of:=SUM([.C25:.AG25]) -> 5
A26: 24 | B26: 11g_Pavarde_24 Vardas_22 | C26: 2 | F26: 5A | G26: 4A | O26: 2B | Q26: 5A | R26: 1B | S26: 3A | T26: 2B | U26: 3A | Y26: 3 | Z26: 2B | AH26: of:=SUM([.C26:.AG26]) -> 5
A27: 25 | B27: 11g_Pavarde_25 Vardas_22 | C27: 2 | F27: 5A | G27: 3B | O27: 3A | Q27: 5A | R27: 1B | S27: 3A | T27: 2B | W27: 3 | Z27: 2B | AH27: of:=SUM([.C27:.AG27]) -> 5
A28: 26 | B28: 11g_Pavarde_26 Vardas_23 | E28: 2 | F28: 5A | G28: 4A | O28: 3A | P28: 2A | Q28: 5A | S28: 3A | T28: 2B | W28: 3 | Z28: 2B | AA28: 1 | AH28: of:=SUM([.C28:.AG28]) -> 6

Sheet: 12a
A1: Eil. | B1: Pavarde Vardas | C1: Dor. ugd. | F1: Leit.k. | G1: 1 užs.kalba | K1: 2 užs.kalba | O1: Ist | P1: Geo | Q1: Mat | R1: Inf | S1: Biol | T1: Fiz | U1: Chem | V1: Menai | Z1: KK | AA1: Pasirenkami | AH1: Viso
A2: Ps | B2: T | C2: E | E2: A1 | F2: V1 | G2: R1 | H2: Pr1 | I2: A2 | J2: V2 | K2: R2 | L2: Pr2 | T2: D | U2: M | V2: Te | W2: S | X2: lot | Y2: isp | Z2: gp | AA2: br | AB2: ek | AC2: pb | AD2: PC
A3: 1 | B3: 12a_Pavarde_1 Vardas_1 | F3: 6A | H3: 5A | K3: 2 | O3: 5A | Q3: 5B | S3: 2B | W3: 1 | Z3: 2 | AH3: of:=SUM([.C3:.AG3]) -> 5
A4: 2 | B4: 12a_Pavarde_2 Vardas_2 | F4: 5B | G4: 5A | N4: 2 | O4: 6A | P4: 2 | Q4: 5A | R4: 1B | S4: 2B | V4: 1 | Z4: 2 | AH4: of:=SUM([.C4:.AG4]) -> 7
A5: 3 | B5: 12a_Pavarde_3 Vardas_3 | F5: 6A | G5: 3B | M5: 2 | O5: 6A | Q5: 6A | R5: 2A | S5: 2B | Y5: 1 | Z5: 2 | AH5: of:=SUM([.C5:.AG5]) -> 5
A6: 4 | B6: 12a_Pavarde_4 Vardas_4 | F6: 6A | G6: 5A | M6: 2 | O6: 6A | P6: 2 | Q6: 6A | R6: 1B | S6: 2B | Z6: 2 | AH6: of:=SUM([.C6:.AG6]) -> 6
A7: 5 | B7: 12a_Pavarde_5 Vardas_4 | F7: 5B | G7: 4A | M7: 2 | O7: 6A | P7: 2 | Q7: 4B | R7: 1B | S7: 2B | Z7: 2 | AC7: 1 | AH7: of:=SUM([.C7:.AG7]) -> 7
A8: 6 | B8: 12a_Pavarde_6 Vardas_5 | F8: 6A | G8: 5A | L8: 2 | O8: 5A | P8: 2 | Q8: 5B | R8: 2A | S8: 2B | W8: 1 | Z8: 2 | AH8: of:=SUM([.C8:.AG8]) -> 7
A9: 7 | B9: 12a_Pavarde_7 Vardas_6 | F9: 5A | H9: 5A | M9: 2 | O9: 5A | Q9: 5A | R9: 2A | S9: 2B | W9: 1 | Z9: 2 | AH9: of:=SUM([.C9:.AG9]) -> 5
A10: 8 | B10: 12a_Pavarde_8 Vardas_7 | F10: 5B | G10: 6A | M10: 2 | O10: 6A | Q10: 6A | R10: 1B | S10: 2B | V10: 1 | Z10: 2 | AH10: of:=SUM([.C10:.AG10]) -> 5
A11: 9 | B11: 12a_Pavarde_9 Vardas_8 | F11: 5B | G11: 4A | O11: 6A | P11: 2 | Q11: 4B | R11: 1B | S11: 2B | V11: 1 | Z11: 2 | AC11: 1 | AH11: of:=SUM([.C11:.AG11]) -> 6
A12: 10 | B12: 12a_Pavarde_10 Vardas_9 | F12: 6A | G12: 5A | N12: 2 | O12: 6A | P12: 2 | Q12: 5A | R12: 1B | S12: 2B | V12: 1 | Z12: 2 | AH12: of:=SUM([.C12:.AG12]) -> 7
A13: 11 | B13: 12a_Pavarde_11 Vardas_10 | F13: 5B | H13: 5A | K13: 2 | O13: 5A | P13: 2 | Q13: 4B | S13: 2B | Z13: 2 | AE13: 1 | AH13: of:=SUM([.C13:.AG13]) -> 7
A14: 12 | B14: 12a_Pavarde_12 Vardas_11 | F14: 5A | G14: 6A | O14: 6A | Q14: 6A | R14: 1B | S14: 2B | X14: 1 | Z14: 2 | AD14: 1 | AH14: of:=SUM([.C14:.AG14]) -> 4
A15: 13 | B15: 12a_Pavarde_13 Vardas_12 | F15: 6A | G15: 4A | O15: 6A | Q15: 5B | R15: 1B | S15: 2B | Z15: 2 | AC15: 1 | AE15: 1 | AH15: of:=SUM([.C15:.AG15]) -> 4
A16: 14 | B16: 12a_Pavarde_14 Vardas_13 | F16: 6A | G16: 6A | L16: 2 | O16: 6A | Q16: 6A | R16: 1B | S16: 2B | Z16: 2 | AH16: of:=SUM([.C16:.AG16]) -> 4
A17: 15 | B17: 12a_Pavarde_15 Vardas_14 | F17: 6A | H17: 5A | K17: 2 | O17: 6A | Q17: 6A | S17: 2B | V17: 1 | Z17: 2 | AH17: of:=SUM([.C17:.AG17]) -> 5
A18: 16 | B18: 12a_Pavarde_16 Vardas_15 | F18: 5B | G18: 6A | M18: 2 | O18: 6A | Q18: 6A | R18: 1B | S18: 2B | Z18: 2 | AC18: 1 | AE18: 1 | AH18: of:=SUM([.C18:.AG18]) -> 6
A19: 17 | B19: 12a_Pavarde_17 Vardas_16 | F19: 6A | H19: 5A | K19: 2 | O19: 6A | P19: 2 | Q19: 5B | S19: 2B | Z19: 2 | AH19: of:=SUM([.C19:.AG19]) -> 6
A20: 18 | B20: 12a_Pavarde_18 Vardas_17 | F20: 6A | G20: 4A | M20: 2 | O20: 6A | Q20: 6A | R20: 1B | S20: 2B | W20: 1 | Z20: 2 | AH20: of:=SUM([.C20:.AG20]) -> 5
A21: 19 | B21: 12a_Pavarde_19 Vardas_18 | F21: 5B | G21: 6A | O21: 6A | P21: 2 | Q21: 5A | R21: 1B | S21: 2B | V21: 1 | Z21: 2 | AH21: of:=SUM([.C21:.AG21]) -> 5
A22: 20 | B22: 12a_Pavarde_20 Vardas_19 | F22: 5B | H22: 5A | K22: 2 | O22: 2B | Q22: 6A | R22: 2A | S22: 2B | Z22: 2 | AD22: 1 | AH22: of:=SUM([.C22:.AG22]) -> 5
A23: 21 | B23: 12a_Pavarde_21 Vardas_20 | F23: 6A | G23: 6A | O23: 6A | Q23: 6A | R23: 2A | S23: 2B | Y23: 1 | Z23: 2 | AE23: 1 | AH23: of:=SUM([.C23:.AG23]) -> 4
A24: 22 | B24: 12a_Pavarde_22 Vardas_21 | F24: 7A | G24: 4A | O24: 2B | P24: 2 | Q24: 5B | R24: 1B | S24: 2B | X24: 1 | Z24: 2 | AE24: 1 | AH24: of:=SUM([.C24:.AG24]) -> 6
A25: 23 | B25: 12a_Pavarde_23 Vardas_21 | F25: 5A | G25: 6A | O25: 6A | Q25: 6A | R25: 1B | S25: 2B | V25: 1 | Z25: 2 | AE25: 1 | AH25: of:=SUM([.C25:.AG25]) -> 4
A26: 24 | B26: 12a_Pavarde_24 Vardas_22 | F26: 6A | G26: 6A | M26: 2 | O26: 6A | Q26: 6A | S26: 2B | V26: 1 | Z26: 2 | AD26: 1 | AH26: of:=SUM([.C26:.AG26]) -> 6
A27: 25 | B27: 12a_Pavarde_25 Vardas_22 | F27: 5B | G27: 4A | M27: 2 | O27: 5A | P27: 2 | Q27: 4B | R27: 2A | S27: 2B | W27: 1 | Z27: 2 | AC27: 1 | AH27: of:=SUM([.C27:.AG27]) -> 8

Sheet: 12b
A1: Eil. | B1: Pavarde Vardas | C1: Dor. ugd. | F1: Leit.k. | G1: 1 užs.kalba | K1: 2 užs.kalba | O1: Ist | P1: Geo | Q1: Mat | R1: Inf | S1: Biol | T1: Fiz | U1: Chem | V1: Menai | Z1: KK | AA1: Pasirenkami | AH1: Viso
A2: Ps | B2: T | C2: E | E2: A1 | F2: V1 | G2: R1 | H2: Pr1 | I2: A2 | J2: V2 | K2: R2 | L2: Pr2 | T2: D | U2: M | V2: Te | W2: S | X2: lot | Y2: isp | Z2: gp | AA2: br | AB2: ek | AC2: pb | AD2: PC
A3: 1 | B3: 12b_Pavarde_1 Vardas_1 | F3: 6A | G3: 6A | M3: 2 | O3: 6A | Q3: 6A | R3: 1B | U3: 2B | X3: 1 | Z3: 2 | AH3: of:=SUM([.C3:.AG3]) -> 5
A4: 2 | B4: 12b_Pavarde_2 Vardas_2 | F4: 6A | G4: 6A | M4: 2 | O4: 6A | Q4: 6A | R4: 1B | S4: 2B | X4: 1 | Z4: 2 | AH4: of:=SUM([.C4:.AG4]) -> 5
A5: 3 | B5: 12b_Pavarde_3 Vardas_3 | F5: 6A | G5: 6A | O5: 6A | Q5: 6A | R5: 1B | U5: 2B | X5: 1 | Z5: 2 | AH5: of:=SUM([.C5:.AG5]) -> 3
A6: 4 | B6: 12b_Pavarde_4 Vardas_4 | F6: 6A | G6: 6A | O6: 6A | P6: 2 | Q6: 6A | R6: 1B | S6: 2B | Y6: 1 | Z6: 2 | AH6: of:=SUM([.C6:.AG6]) -> 5
A7: 5 | B7: 12b_Pavarde_5 Vardas_4 | F7: 6A | G7: 6A | O7: 6A | P7: 2 | Q7: 6A | R7: 1B | S7: 2B | X7: 1 | Z7: 2 | AH7: of:=SUM([.C7:.AG7]) -> 5
A8: 6 | B8: 12b_Pavarde_6 Vardas_5 | F8: 5A | G8: 6A | M8: 2 | O8: 5A | P8: 2 | Q8: 6A | R8: 1B | U8: 2B | X8: 1 | Z8: 2 | AH8: of:=SUM([.C8:.AG8]) -> 7
A9: 7 | B9: 12b_Pavarde_7 Vardas_6 | F9: 6A | G9: 6A | O9: 6A | Q9: 6A | R9: 1B | S9: 2B | Z9: 2 | AE9: 1 | AH9: of:=SUM([.C9:.AG9]) -> 3
A10: 8 | B10: 12b_Pavarde_8 Vardas_7 | F10: 6A | G10: 6A | L10: 2 | O10: 6A | P10: 2 | Q10: 3B | R10: 1B | S10: 2B | X10: 1 | Z10: 2 | AA10: 1 | AH10: of:=SUM([.C10:.AG10]) -> 8
A11: 9 | B11: 12b_Pavarde_9 Vardas_8 | F11: 6A | G11: 6A | O11: 6A | Q11: 6A | R11: 1B | S11: 2B | Z11: 2 | AE11: 1 | AH11: of:=SUM([.C11:.AG11]) -> 3
A12: 10 | B12: 12b_Pavarde_10 Vardas_9 | F12: 6A | G12: 6A | M12: 2 | O12: 6A | P12: 2 | Q12: 4B | R12: 1B | S12: 2B | X12: 1 | Z12: 2 | AH12: of:=SUM([.C12:.AG12]) -> 7
A13: 11 | B13: 12b_Pavarde_11 Vardas_10 | F13: 6A | G13: 6A | N13: 2 | O13: 6A | Q13: 4B | R13: 1B | S13: 2B | X13: 1 | Z13: 2 | AH13: of:=SUM([.C13:.AG13]) -> 5
A14: 12 | B14: 12b_Pavarde_12 Vardas_11 | F14: 6A | G14: 6A | O14: 6A | Q14: 4B | R14: 1B | S14: 2B | Y14: 1 | Z14: 2 | AC14: 1 | AH14: of:=SUM([.C14:.AG14]) -> 4
A15: 13 | B15: 12b_Pavarde_13 Vardas_12 | F15: 6A | G15: 6A | O15: 6A | P15: 2 | Q15: 5B | R15: 1B | S15: 2B | Y15: 1 | Z15: 2 | AH15: of:=SUM([.C15:.AG15]) -> 5
A16: 14 | B16: 12b_Pavarde_14 Vardas_13 | F16: 7A | G16: 6A | L16: 2 | O16: 6A | Q16: 6A | R16: 1B | S16: 2B | Z16: 2 | AH16: of:=SUM([.C16:.AG16]) -> 4
A17: 15 | B17: 12b_Pavarde_15 Vardas_14 | F17: 5A | G17: 5A | M17: 2 | O17: 6A | P17: 2 | Q17: 6A | R17: 1B | S17: 2B | Y17: 1 | Z17: 2 | AH17: of:=SUM([.C17:.AG17]) -> 7
A18: 16 | B18: 12b_Pavarde_16 Vardas_15 | F18: 6A | G18: 6A | O18: 6A | P18: 2 | Q18: 6A | R18: 1B | S18: 2B | X18: 1 | Z18: 2 | AH18: of:=SUM([.C18:.AG18]) -> 5
A19: 17 | B19: 12b_Pavarde_17 Vardas_16 | F19: 6A | G19: 6A | N19: 2 | O19: 6A | Q19: 5B | R19: 1B | S19: 2B | Z19: 2 | AH19: of:=SUM([.C19:.AG19]) -> 4
A20: 18 | B20: 12b_Pavarde_18 Vardas_17 | F20: 6A | G20: 6A | N20: 2 | O20: 6A | Q20: 5B | R20: 1B | U20: 2B | Z20: 2 | AH20: of:=SUM([.C20:.AG20]) -> 4
A21: 19 | B21: 12b_Pavarde_19 Vardas_18 | F21: 6A | G21: 6A | L21: 2 | O21: 6A | Q21: 4B | R21: 1B | S21: 2B | X21: 1 | Z21: 2 | AA21: 1 | AH21: of:=SUM([.C21:.AG21]) -> 6
A22: 20 | B22: 12b_Pavarde_20 Vardas_19 | F22: 6A | G22: 6A | O22: 6A | Q22: 6A | R22: 1B | S22: 2B | X22: 1 | Z22: 2 | AC22: 1 | AH22: of:=SUM([.C22:.AG22]) -> 4
A23: 21 | B23: 12b_Pavarde_21 Vardas_20 | F23: 6A | G23: 6A | L23: 2 | O23: 6A | Q23: 4B | R23: 1B | S23: 2B | Y23: 2 | Z23: 2 | AH23: of:=SUM([.C23:.AG23]) -> 6
A24: 22 | B24: 12b_Pavarde_22 Vardas_21 | F24: 6A | G24: 6A | N24: 2 | O24: 5A | P24: 2 | Q24: 6A | R24: 1B | S24: 2B | Z24: 2 | AH24: of:=SUM([.C24:.AG24]) -> 6
A25: 23 | B25: 12b_Pavarde_23 Vardas_21 | F25: 6A | G25: 6A | O25: 6A | P25: 2 | Q25: 6A | R25: 1B | U25: 2B | Y25: 1 | Z25: 2 | AH25: of:=SUM([.C25:.AG25]) -> 5
A26: 24 | B26: 12b_Pavarde_24 Vardas_22 | F26: 6A | G26: 6A | O26: 6A | P26: 2 | Q26: 6A | R26: 1B | S26: 2B | Y26: 1 | Z26: 2 | AH26: of:=SUM([.C26:.AG26]) -> 5
A27: 25 | B27: 12b_Pavarde_25 Vardas_22 | F27: 6A | G27: 6A | O27: 6A | Q27: 4B | R27: 1B | S27: 2B | Y27: 1 | Z27: 2 | AH27: of:=SUM([.C27:.AG27]) -> 3

Sheet: 12c
A1: Eil. | B1: Pavarde Vardas | C1: Dor. ugd. | F1: Leit.k. | G1: 1 užs.kalba | K1: 2 užs.kalba | O1: Ist | P1: Geo | Q1: Mat | R1: Inf | S1: Biol | T1: Fiz | U1: Chem | V1: Menai | Z1: KK | AA1: Pasirenkami | AH1: Viso
A2: Ps | B2: T | C2: E | E2: A1 | F2: V1 | G2: R1 | H2: Pr1 | I2: A2 | J2: V2 | K2: R2 | L2: Pr2 | T2: D | U2: M | V2: Te | W2: S | X2: lot | Y2: isp | Z2: gp | AA2: br | AB2: ek | AC2: pb | AD2: PC
A3: 1 | B3: 12c_Pavarde_1 Vardas_1 | F3: 6A | G3: 6A | O3: 2B | Q3: 6A | T3: 4A | U3: 2B | Z3: 2 | AD3: 1 | AH3: of:=SUM([.C3:.AG3]) -> 3
A4: 2 | B4: 12c_Pavarde_2 Vardas_2 | F4: 6A | G4: 5A | O4: 5A | Q4: 5A | R4: 1B | T4: 4A | U4: 2B | Y4: 1 | Z4: 2 | AH4: of:=SUM([.C4:.AG4]) -> 3
A5: 3 | B5: 12c_Pavarde_3 Vardas_3 | F5: 5A | G5: 6A | O5: 5A | Q5: 6A | S5: 4A | U5: 2B | Y5: 1 | Z5: 2 | AH5: of:=SUM([.C5:.AG5]) -> 3
A6: 4 | B6: 12c_Pavarde_4 Vardas_4 | F6: 6A | G6: 5A | O6: 5A | Q6: 5A | R6: 1B | T6: 5A | U6: 2B | Y6: 1 | Z6: 2 | AH6: of:=SUM([.C6:.AG6]) -> 3
A7: 5 | B7: 12c_Pavarde_5 Vardas_4 | F7: 6A | G7: 6A | M7: 2 | O7: 5A | Q7: 6A | R7: 1B | T7: 4A | Z7: 2 | AH7: of:=SUM([.C7:.AG7]) -> 4
A8: 6 | B8: 12c_Pavarde_6 Vardas_5 | F8: 7A | G8: 5A | O8: 4A | Q8: 6A | R8: 1B | S8: 4A | U8: 2B | Y8: 1 | Z8: 2 | AH8: of:=SUM([.C8:.AG8]) -> 3
A9: 7 | B9: 12c_Pavarde_7 Vardas_6 | F9: 6A | G9: 5A | O9: 2B | Q9: 6A | T9: 5A | U9: 2B | Z9: 2 | AH9: of:=SUM([.C9:.AG9]) -> 2
A10: 8 | B10: 12c_Pavarde_8 Vardas_7 | F10: 5B | G10: 5A | M10: 2 | O10: 2B | Q10: 4B | R10: 1B | S10: 4A | U10: 4A | Y10: 1 | Z10: 2 | AA10: 1 | AH10: of:=SUM([.C10:.AG10]) -> 6
A11: 9 | B11: 12c_Pavarde_9 Vardas_8 | F11: 7A | G11: 5A | O11: 2B | Q11: 6A | R11: 1B | S11: 4A | U11: 4A | Z11: 2 | AA11: 1 | AH11: of:=SUM([.C11:.AG11]) -> 3
A12: 10 | B12: 12c_Pavarde_10 Vardas_9 | F12: 6A | G12: 6A | L12: 2 | O12: 2B | Q12: 6A | S12: 4A | U12: 4A | Z12: 2 | AH12: of:=SUM([.C12:.AG12]) -> 4
A13: 11 | B13: 12c_Pavarde_11 Vardas_10 | F13: 7A | G13: 5A | O13: 2B | Q13: 6A | R13: 1B | S13: 4A | U13: 4A | X13: 1 | Z13: 2 | AH13: of:=SUM([.C13:.AG13]) -> 3
A14: 12 | B14: 12c_Pavarde_12 Vardas_11 | F14: 5A | H14: 5A | K14: 2 | O14: 6A | Q14: 6A | R14: 1B | S14: 4A | X14: 1 | Z14: 2 | AH14: of:=SUM([.C14:.AG14]) -> 5
A15: 13 | B15: 12c_Pavarde_13 Vardas_12 | F15: 6A | G15: 5A | M15: 2 | O15: 5A | Q15: 6A | R15: 2A | U15: 2B | Z15: 2 | AA15: 1 | AH15: of:=SUM([.C15:.AG15]) -> 5
A16: 14 | B16: 12c_Pavarde_14 Vardas_13 | F16: 6A | G16: 5A | L16: 2 | O16: 2B | P16: 2 | Q16: 6A | R16: 1B | T16: 2B | Z16: 2 | AD16: 1 | AH16: of:=SUM([.C16:.AG16]) -> 7
A17: 15 | B17: 12c_Pavarde_15 Vardas_14 | F17: 6A | G17: 6A | M17: 2 | O17: 2B | Q17: 6A | S17: 4A | U17: 4A | Z17: 2 | AH17: of:=SUM([.C17:.AG17]) -> 4
A18: 16 | B18: 12c_Pavarde_16 Vardas_15 | F18: 6A | G18: 6A | O18: 2B | Q18: 6A | R18: 1B | T18: 2B | U18: 2B | Z18: 2 | AD18: 1 | AH18: of:=SUM([.C18:.AG18]) -> 3
A19: 17 | B19: 12c_Pavarde_17 Vardas_16 | F19: 5A | G19: 5A | M19: 2 | O19: 2B | Q19: 6A | R19: 1B | T19: 5A | U19: 2B | X19: 1 | Z19: 2 | AD19: 1 | AH19: of:=SUM([.C19:.AG19]) -> 6
A20: 18 | B20: 12c_Pavarde_18 Vardas_17 | F20: 7A | G20: 5A | O20: 4A | Q20: 6A | R20: 1B | S20: 4A | U20: 2B | Y20: 1 | Z20: 2 | AH20: of:=SUM([.C20:.AG20]) -> 3
A21: 19 | B21: 12c_Pavarde_19 Vardas_18 | F21: 6A | G21: 6A | O21: 2B | Q21: 6A | R21: 1B | S21: 4A | U21: 4A | Y21: 1 | Z21: 2 | AH21: of:=SUM([.C21:.AG21]) -> 3
A22: 20 | B22: 12c_Pavarde_20 Vardas_19 | F22: 6A | G22: 6A | O22: 2B | Q22: 6A | R22: 1B | T22: 5A | U22: 2B | Z22: 2 | AD22: 1 | AH22: of:=SUM([.C22:.AG22]) -> 3
A23: 21 | B23: 12c_Pavarde_21 Vardas_20 | F23: 5A | G23: 5A | O23: 5A | Q23: 6A | R23: 1B | T23: 5A | U23: 2B | Z23: 2 | AD23: 1 | AH23: of:=SUM([.C23:.AG23]) -> 3
A24: 22 | B24: 12c_Pavarde_22 Vardas_21 | F24: 6A | G24: 4B | O24: 2B | Q24: 6A | R24: 1B | S24: 4A | U24: 2B | Z24: 2 | AA24: 1 | AH24: of:=SUM([.C24:.AG24]) -> 3
A25: 23 | B25: 12c_Pavarde_23 Vardas_21 | F25: 6A | G25: 5A | O25: 2B | Q25: 6A | R25: 1B | T25: 4A | U25: 2B | Z25: 2 | AD25: 1 | AH25: of:=SUM([.C25:.AG25]) -> 3
A26: 24 | B26: 12c_Pavarde_24 Vardas_22 | F26: 6A | G26: 5A | O26: 5A | Q26: 5A | R26: 1B | T26: 4A | U26: 4A | Z26: 2 | AH26: of:=SUM([.C26:.AG26]) -> 2
A27: 25 | B27: 12c_Pavarde_25 Vardas_22 | F27: 6A | G27: 6A | P27: 2 | Q27: 6A | R27: 2A | T27: 4A | X27: 1 | Z27: 2 | AD27: 1 | AE27: 1 | AH27: of:=SUM([.C27:.AG27]) -> 7
A28: 26 | B28: 12c_Pavarde_26 Vardas_23 | F28: 5A | H28: 5A | K28: 2 | O28: 6A | P28: 2 | Q28: 6A | R28: 1B | T28: 2B | W28: 1 | Z28: 2 | AH28: of:=SUM([.C28:.AG28]) -> 7
A29: 27 | B29: 12c_Pavarde_27 Vardas_23 | F29: 6A | G29: 6A | M29: 2 | O29: 2B | Q29: 6A | S29: 4A | U29: 4A | Z29: 2 | AH29: of:=SUM([.C29:.AG29]) -> 4
A30: 28 | B30: 12c_Pavarde_28 Vardas_24 | F30: 6A | H30: 5A | K30: 2 | O30: 2B | Q30: 4B | S30: 4A | U30: 4A | Y30: 1 | Z30: 2 | AH30: of:=SUM([.C30:.AG30]) -> 5
A31: 29 | B31: 12c_Pavarde_29 Vardas_25 | F31: 7A | G31: 5A | O31: 2B | Q31: 6A | S31: 4A | U31: 4A | X31: 1 | Z31: 2 | AA31: 1 | AH31: of:=SUM([.C31:.AG31]) -> 4
A32: 30 | B32: 12c_Pavarde_30 Vardas_26 | F32: 5A | G32: 5A | O32: 5A | Q32: 6A | R32: 1B | T32: 5A | U32: 2B | Y32: 1 | Z32: 2 | AH32: of:=SUM([.C32:.AG32]) -> 3

Sheet: 12d
A1: Eil. | B1: Pavarde Vardas | C1: Dor. ugd. | F1: Leit.k. | G1: 1 užs.kalba | K1: 2 užs.kalba | O1: Ist | P1: Geo | Q1: Mat | R1: Inf | S1: Biol | T1: Fiz | U1: Chem | V1: Menai | Z1: KK | AA1: Pasirenkami | AH1: Viso
A2: Ps | B2: T | C2: E | E2: A1 | F2: V1 | G2: R1 | H2: Pr1 | I2: A2 | J2: V2 | K2: R2 | L2: Pr2 | T2: D | U2: M | V2: Te | W2: S | X2: lot | Y2: isp | Z2: gp | AA2: br | AB2: ek | AC2: pb | AD2: PC
A3: 1 | B3: 12d_Pavarde_1 Vardas_1 | F3: 6A | G3: 6A | O3: 6A | Q3: 6A | S3: 2A | U3: 2B | Z3: 2 | AH3: of:=SUM([.C3:.AG3]) -> 2
A4: 2 | B4: 12d_Pavarde_2 Vardas_2 | F4: 6A | G4: 6A | O4: 6A | Q4: 6A | S4: 2A | T4: 2B | Y4: 1 | Z4: 2 | AH4: of:=SUM([.C4:.AG4]) -> 3
A5: 3 | B5: 12d_Pavarde_3 Vardas_3 | F5: 7A | G5: 4B | O5: 2B | Q5: 5A | R5: 1B | S5: 4A | T5: 2B | U5: 2B | Y5: 1 | Z5: 2 | AA5: 1 | AH5: of:=SUM([.C5:.AG5]) -> 4
A6: 4 | B6: 12d_Pavarde_4 Vardas_4 | F6: 6A | G6: 5A | O6: 2B | Q6: 6A | R6: 1B | S6: 4A | U6: 4A | Y6: 1 | Z6: 2 | AA6: 1 | AH6: of:=SUM([.C6:.AG6]) -> 4
A7: 5 | B7: 12d_Pavarde_5 Vardas_4 | F7: 5B | G7: 6A | O7: 2B | Q7: 6A | R7: 2A | T7: 2B | U7: 2B | W7: 1 | Z7: 2 | AH7: of:=SUM([.C7:.AG7]) -> 3
A8: 6 | B8: 12d_Pavarde_6 Vardas_5 | F8: 6A | G8: 6A | O8: 2B | Q8: 6A | R8: 1B | S8: 4A | T8: 5A | Z8: 2 | AH8: of:=SUM([.C8:.AG8]) -> 2
A9: 7 | B9: 12d_Pavarde_7 Vardas_6 | F9: 6A | G9: 6A | O9: 6A | Q9: 6A | R9: 1B | S9: 2A | T9: 2B | X9: 1 | Z9: 2 | AH9: of:=SUM([.C9:.AG9]) -> 3
A10: 8 | B10: 12d_Pavarde_8 Vardas_7 | F10: 6A | G10: 6A | O10: 6A | Q10: 6A | R10: 2A | T10: 2B | U10: 2B | Z10: 2 | AH10: of:=SUM([.C10:.AG10]) -> 2
A11: 9 | B11: 12d_Pavarde_9 Vardas_8 | F11: 5B | G11: 6A | O11: 2B | Q11: 6A | R11: 2A | S11: 2A | T11: 2B | X11: 1 | Z11: 2 | AH11: of:=SUM([.C11:.AG11]) -> 3
A12: 10 | B12: 12d_Pavarde_10 Vardas_9 | F12: 6A | G12: 6A | O12: 2B | Q12: 6A | R12: 1B | S12: 4A | U12: 4A | Y12: 1 | Z12: 2 | AH12: of:=SUM([.C12:.AG12]) -> 3
A13: 11 | B13: 12d_Pavarde_11 Vardas_10 | F13: 6A | G13: 5A | O13: 2B | Q13: 6A | R13: 1B | S13: 4A | T13: 2B | U13: 4A | Z13: 2 | AH13: of:=SUM([.C13:.AG13]) -> 2
A14: 12 | B14: 12d_Pavarde_12 Vardas_11 | F14: 6A | G14: 6A | O14: 6A | Q14: 6A | R14: 1B | T14: 2B | U14: 2B | Y14: 1 | Z14: 2 | AH14: of:=SUM([.C14:.AG14]) -> 3
A15: 13 | B15: 12d_Pavarde_13 Vardas_12 | F15: 6A | G15: 5A | O15: 6A | Q15: 6A | R15: 1B | S15: 3A | T15: 2B | X15: 1 | Z15: 2 | AH15: of:=SUM([.C15:.AG15]) -> 3
A16: 14 | B16: 12d_Pavarde_14 Vardas_13 | F16: 7A | G16: 5A | O16: 2B | Q16: 5A | R16: 1B | S16: 2A | T16: 2B | W16: 1 | Z16: 2 | AD16: 1 | AH16: of:=SUM([.C16:.AG16]) -> 4
A17: 15 | B17: 12d_Pavarde_15 Vardas_14 | F17: 6A | G17: 3B | O17: 2B | Q17: 6A | R17: 1B | S17: 4A | T17: 2B | U17: 2B | X17: 1 | Z17: 2 | AH17: of:=SUM([.C17:.AG17]) -> 3
A18: 16 | B18: 12d_Pavarde_16 Vardas_15 | F18: 6A | G18: 6A | O18: 6A | Q18: 6A | R18: 1B | T18: 2B | U18: 2B | Y18: 1 | Z18: 2 | AH18: of:=SUM([.C18:.AG18]) -> 3
A19: 17 | B19: 12d_Pavarde_17 Vardas_16 | F19: 6A | G19: 6A | O19: 6A | Q19: 7A | R19: 1B | U19: 2B | Y19: 1 | Z19: 2 | AH19: of:=SUM([.C19:.AG19]) -> 3
A20: 18 | B20: 12d_Pavarde_18 Vardas_17 | F20: 6A | G20: 5A | O20: 6A | Q20: 5A | R20: 1B | S20: 4A | T20: 2B | X20: 1 | Z20: 2 | AH20: of:=SUM([.C20:.AG20]) -> 3
A21: 19 | B21: 12d_Pavarde_19 Vardas_18 | F21: 6A | G21: 6A | O21: 6A | Q21: 6A | R21: 1B | T21: 2B | U21: 2B | Z21: 2 | AH21: of:=SUM([.C21:.AG21]) -> 2
A22: 20 | B22: 12d_Pavarde_20 Vardas_19 | F22: 6A | G22: 6A | O22: 6A | Q22: 6A | R22: 1B | T22: 2B | U22: 2B | Y22: 1 | Z22: 2 | AH22: of:=SUM([.C22:.AG22]) -> 3
A23: 21 | B23: 12d_Pavarde_21 Vardas_20 | F23: 6A | G23: 5A | O23: 6A | Q23: 6A | R23: 1B | S23: 2A | U23: 2B | V23: 1 | Z23: 2 | AH23: of:=SUM([.C23:.AG23]) -> 3
A24: 22 | B24: 12d_Pavarde_22 Vardas_21 | F24: 6A | G24: 6A | O24: 2B | Q24: 6A | R24: 1B | S24: 4A | U24: 4A | W24: 1 | Z24: 2 | AH24: of:=SUM([.C24:.AG24]) -> 3
A25: 23 | B25: 12d_Pavarde_23 Vardas_21 | F25: 6A | G25: 6A | O25: 2B | Q25: 6A | R25: 1B | S25: 4A | U25: 4A | W25: 1 | Z25: 2 | AH25: of:=SUM([.C25:.AG25]) -> 3
A26: 24 | B26: 12d_Pavarde_24 Vardas_22 | F26: 6A | G26: 4B | O26: 5A | Q26: 4B | R26: 1B | S26: 4A | T26: 2B | W26: 1 | Z26: 2 | AH26: of:=SUM([.C26:.AG26]) -> 3
A27: 25 | B27: 12d_Pavarde_25 Vardas_22 | F27: 5A | G27: 5A | O27: 2B | Q27: 6A | R27: 1B | S27: 4A | T27: 5A | U27: 2B | Z27: 2 | AH27: of:=SUM([.C27:.AG27]) -> 2

Sheet: 12e
A1: Eil. | B1: Pavarde Vardas | C1: Dor. ugd. | F1: Leit.k. | G1: 1 užs.kalba | K1: 2 užs.kalba | O1: Ist | P1: Geo | Q1: Mat | R1: Inf | S1: Biol | T1: Fiz | U1: Chem | V1: Menai | Z1: KK | AA1: Pasirenkami | AH1: Viso
A2: Ps | B2: T | C2: E | E2: A1 | F2: V1 | G2: R1 | H2: Pr1 | I2: A2 | J2: V2 | K2: R2 | L2: Pr2 | T2: D | U2: M | V2: Te | W2: S | X2: lot | Y2: isp | Z2: gp | AA2: br | AB2: ek | AC2: pb | AD2: PC
A3: 1 | B3: 12e_Pavarde_1 Vardas_1 | F3: 6A | G3: 6A | O3: 6A | Q3: 6A | R3: 1B | T3: 2B | Z3: 2 | AH3: of:=SUM([.C3:.AG3]) -> 2
A4: 2 | B4: 12e_Pavarde_2 Vardas_2 | F4: 6A | G4: 6A | O4: 6A | Q4: 6A | R4: 1B | T4: 2B | Y4: 1 | Z4: 2 | AH4: of:=SUM([.C4:.AG4]) -> 3
A5: 3 | B5: 12e_Pavarde_3 Vardas_3 | F5: 6A | G5: 6A | O5: 6A | Q5: 6A | R5: 2A | T5: 2B | Z5: 2 | AH5: of:=SUM([.C5:.AG5]) -> 2
A6: 4 | B6: 12e_Pavarde_4 Vardas_4 | F6: 7A | G6: 6A | M6: 2 | O6: 6A | Q6: 6A | R6: 1B | T6: 2B | Z6: 2 | AH6: of:=SUM([.C6:.AG6]) -> 4
A7: 5 | B7: 12e_Pavarde_5 Vardas_4 | F7: 4B | G7: 6A | N7: 2 | O7: 6A | P7: 2 | Q7: 6A | R7: 1B | T7: 2B | V7: 1 | Z7: 2 | AH7: of:=SUM([.C7:.AG7]) -> 7
A8: 6 | B8: 12e_Pavarde_6 Vardas_5 | F8: 6A | G8: 6A | O8: 6A | Q8: 7A | R8: 2A | T8: 2B | Z8: 2 | AH8: of:=SUM([.C8:.AG8]) -> 2
A9: 7 | B9: 12e_Pavarde_7 Vardas_6 | F9: 6A | G9: 6A | O9: 6A | Q9: 6A | R9: 1B | T9: 2B | Z9: 2 | AH9: of:=SUM([.C9:.AG9]) -> 2
A10: 8 | B10: 12e_Pavarde_8 Vardas_7 | F10: 6A | G10: 6A | M10: 2 | O10: 6A | Q10: 6A | R10: 1B | T10: 2B | Z10: 2 | AH10: of:=SUM([.C10:.AG10]) -> 4
A11: 9 | B11: 12e_Pavarde_9 Vardas_8 | F11: 6A | G11: 5A | O11: 6A | Q11: 6A | R11: 1B | T11: 2B | W11: 1 | Z11: 2 | AH11: of:=SUM([.C11:.AG11]) -> 3
A12: 10 | B12: 12e_Pavarde_10 Vardas_9 | F12: 6A | G12: 6A | O12: 6A | Q12: 6A | R12: 1B | T12: 2B | V12: 1 | Z12: 2 | AD12: 1 | AH12: of:=SUM([.C12:.AG12]) -> 4
A13: 11 | B13: 12e_Pavarde_11 Vardas_10 | F13: 6A | G13: 6A | M13: 2 | O13: 6A | Q13: 6A | R13: 1B | T13: 2B | Z13: 2 | AH13: of:=SUM([.C13:.AG13]) -> 4
A14: 12 | B14: 12e_Pavarde_12 Vardas_11 | F14: 6A | G14: 6A | O14: 6A | Q14: 6A | R14: 1B | T14: 2B | V14: 1 | Z14: 2 | AD14: 1 | AH14: of:=SUM([.C14:.AG14]) -> 4
A15: 13 | B15: 12e_Pavarde_13 Vardas_12 | F15: 6A | G15: 6A | O15: 6A | Q15: 6A | R15: 1B | T15: 2B | V15: 1 | Z15: 2 | AD15: 1 | AH15: of:=SUM([.C15:.AG15]) -> 4
A16: 14 | B16: 12e_Pavarde_14 Vardas_13 | F16: 6A | G16: 6A | O16: 6A | Q16: 6A | R16: 1B | T16: 2B | V16: 1 | Z16: 2 | AD16: 1 | AH16: of:=SUM([.C16:.AG16]) -> 4
A17: 15 | B17: 12e_Pavarde_15 Vardas_14 | F17: 7A | G17: 6A | O17: 6A | Q17: 6A | R17: 1B | T17: 2B | X17: 1 | Z17: 2 | AE17: 1 | AH17: of:=SUM([.C17:.AG17]) -> 4
A18: 16 | B18: 12e_Pavarde_16 Vardas_15 | F18: 7A | G18: 6A | O18: 5A | Q18: 5B | R18: 1B | T18: 2B | Z18: 2 | AC18: 1 | AD18: 1 | AH18: of:=SUM([.C18:.AG18]) -> 4
A19: 17 | B19: 12e_Pavarde_17 Vardas_16 | F19: 7A | G19: 6A | O19: 6A | Q19: 7A | R19: 1B | T19: 2B | Z19: 2 | AH19: of:=SUM([.C19:.AG19]) -> 2
A20: 18 | B20: 12e_Pavarde_18 Vardas_17 | F20: 6A | G20: 6A | O20: 6A | P20: 2 | Q20: 6A | R20: 2A | T20: 2B | Z20: 2 | AH20: of:=SUM([.C20:.AG20]) -> 4
A21: 19 | B21: 12e_Pavarde_19 Vardas_18 | F21: 6A | G21: 6A | O21: 6A | Q21: 6A | R21: 1B | T21: 2B | X21: 1 | Z21: 2 | AH21: of:=SUM([.C21:.AG21]) -> 3
A22: 20 | B22: 12e_Pavarde_20 Vardas_19 | F22: 6A | G22: 6A | L22: 2 | O22: 6A | Q22: 6A | R22: 1B | T22: 2B | Z22: 2 | AH22: of:=SUM([.C22:.AG22]) -> 4
A23: 21 | B23: 12e_Pavarde_21 Vardas_20 | F23: 6A | G23: 4A | O23: 5A | P23: 2 | Q23: 5B | R23: 1B | T23: 2B | X23: 1 | Z23: 2 | AH23: of:=SUM([.C23:.AG23]) -> 5
A24: 22 | B24: 12e_Pavarde_22 Vardas_21 | F24: 6A | G24: 6A | O24: 6A | Q24: 7A | R24: 2A | T24: 2B | X24: 1 | Z24: 2 | AH24: of:=SUM([.C24:.AG24]) -> 3
A25: 23 | B25: 12e_Pavarde_23 Vardas_21 | F25: 7A | G25: 6A | O25: 6A | P25: 2 | Q25: 5B | R25: 1B | T25: 2B | Z25: 2 | AH25: of:=SUM([.C25:.AG25]) -> 4
A26: 24 | B26: 12e_Pavarde_24 Vardas_22 | F26: 6A | G26: 6A | O26: 6A | Q26: 6A | R26: 1B | T26: 2B | Z26: 2 | AH26: of:=SUM([.C26:.AG26]) -> 2
A27: 25 | B27: 12e_Pavarde_25 Vardas_22 | F27: 6A | G27: 6A | N27: 2 | O27: 6A | Q27: 7A | R27: 1B | T27: 2B | Z27: 2 | AH27: of:=SUM([.C27:.AG27]) -> 4
A28: 26 | B28: 12e_Pavarde_26 Vardas_23 | F28: 6A | G28: 6A | M28: 2 | O28: 6A | Q28: 6A | R28: 1B | T28: 2B | Z28: 2 | AH28: of:=SUM([.C28:.AG28]) -> 4
A29: 27 | B29: 12e_Pavarde_27 Vardas_23 | F29: 6A | G29: 6A | N29: 2 | O29: 6A | Q29: 6A | R29: 1B | T29: 2B | V29: 1 | Z29: 2 | AD29: 1 | AH29: of:=SUM([.C29:.AG29]) -> 6
A30: 28 | B30: 12e_Pavarde_28 Vardas_24 | F30: 6A | G30: 6A | L30: 2 | O30: 6A | Q30: 6A | R30: 1B | T30: 2B | Z30: 2 | AH30: of:=SUM([.C30:.AG30]) -> 4
A31: 29 | B31: 12e_Pavarde_29 Vardas_25 | F31: 6A | G31: 6A | O31: 6A | Q31: 6A | R31: 1B | T31: 2B | Y31: 1 | Z31: 2 | AC31: 1 | AH31: of:=SUM([.C31:.AG31]) -> 4

Sheet: 12f
A1: Eil. | B1: Pavarde Vardas | C1: Dor. ugd. | F1: Leit.k. | G1: 1 užs.kalba | K1: 2 užs.kalba | O1: Ist | P1: Geo | Q1: Mat | R1: Inf | S1: Biol | T1: Fiz | U1: Chem | V1: Menai | Z1: KK | AA1: Pasirenkami | AH1: Viso
A2: Ps | B2: T | C2: E | E2: A1 | F2: V1 | G2: R1 | H2: Pr1 | I2: A2 | J2: V2 | K2: R2 | L2: Pr2 | T2: D | U2: M | V2: Te | W2: S | X2: lot | Y2: isp | Z2: gp | AA2: br | AB2: ek | AC2: pb | AD2: PC
A3: 1 | B3: 12f_Pavarde_1 Vardas_1 | F3: 7A | H3: 5A | M3: 2 | O3: 6A | Q3: 6A | R3: 1B | U3: 2B | Y3: 1 | Z3: 2 | AH3: of:=SUM([.C3:.AG3]) -> 5
A4: 2 | B4: 12f_Pavarde_2 Vardas_2 | F4: 6A | G4: 5A | O4: 2B | Q4: 6A | R4: 1B | T4: 5A | U4: 2B | Z4: 2 | AH4: of:=SUM([.C4:.AG4]) -> 2
A5: 3 | B5: 12f_Pavarde_3 Vardas_3 | F5: 6A | H5: 5A | K5: 2 | O5: 6A | Q5: 6A | R5: 1B | S5: 2B | W5: 1 | Z5: 2 | AH5: of:=SUM([.C5:.AG5]) -> 5
A6: 4 | B6: 12f_Pavarde_4 Vardas_4 | F6: 6A | G6: 6A | M6: 2 | O6: 2B | P6: 2 | Q6: 6A | R6: 1B | U6: 2B | Z6: 2 | AH6: of:=SUM([.C6:.AG6]) -> 6
A7: 5 | B7: 12f_Pavarde_5 Vardas_4 | F7: 6A | G7: 6A | O7: 2B | Q7: 6A | R7: 1B | T7: 5A | V7: 1 | Z7: 2 | AH7: of:=SUM([.C7:.AG7]) -> 3
A8: 6 | B8: 12f_Pavarde_6 Vardas_5 | F8: 6A | G8: 6A | M8: 2 | O8: 2B | Q8: 6A | R8: 1B | S8: 2B | W8: 1 | Z8: 2 | AH8: of:=SUM([.C8:.AG8]) -> 5
A9: 7 | B9: 12f_Pavarde_7 Vardas_6 | F9: 6A | H9: 5A | O9: 6A | Q9: 6A | R9: 1B | T9: 5A | Y9: 1 | Z9: 2 | AH9: of:=SUM([.C9:.AG9]) -> 3
A10: 8 | B10: 12f_Pavarde_8 Vardas_7 | F10: 6A | G10: 6A | O10: 5A | Q10: 4B | R10: 1B | U10: 2B | Y10: 1 | Z10: 2 | AC10: 1 | AH10: of:=SUM([.C10:.AG10]) -> 4
A11: 9 | B11: 12f_Pavarde_9 Vardas_8 | F11: 6A | G11: 5A | O11: 2B | Q11: 6A | R11: 1B | T11: 5A | U11: 2B | V11: 1 | Z11: 2 | AD11: 1 | AH11: of:=SUM([.C11:.AG11]) -> 4
A12: 10 | B12: 12f_Pavarde_10 Vardas_9 | F12: 6A | G12: 6A | O12: 2B | P12: 2 | Q12: 4B | R12: 1B | S12: 4B | Z12: 2 | AC12: 1 | AH12: of:=SUM([.C12:.AG12]) -> 5
A13: 11 | B13: 12f_Pavarde_11 Vardas_10 | F13: 6A | G13: 5A | O13: 5A | Q13: 5B | R13: 1B | S13: 4B | U13: 2B | V13: 1 | Z13: 2 | AD13: 1 | AH13: of:=SUM([.C13:.AG13]) -> 4
A14: 12 | B14: 12f_Pavarde_12 Vardas_11 | F14: 6A | G14: 5A | O14: 2B | Q14: 6A | R14: 1B | T14: 5A | Z14: 2 | AD14: 1 | AH14: of:=SUM([.C14:.AG14]) -> 3
A15: 13 | B15: 12f_Pavarde_13 Vardas_12 | F15: 6A | G15: 6A | O15: 2B | Q15: 7A | R15: 1B | T15: 5A | U15: 2B | Z15: 2 | AD15: 1 | AH15: of:=SUM([.C15:.AG15]) -> 3
A16: 14 | B16: 12f_Pavarde_14 Vardas_13 | F16: 6A | G16: 5A | O16: 2B | Q16: 6A | R16: 1B | T16: 4A | U16: 2B | Z16: 2 | AD16: 1 | AH16: of:=SUM([.C16:.AG16]) -> 3
A17: 15 | B17: 12f_Pavarde_15 Vardas_14 | F17: 6A | G17: 6A | O17: 2B | Q17: 6A | R17: 1B | T17: 5A | U17: 2B | Y17: 1 | Z17: 2 | AH17: of:=SUM([.C17:.AG17]) -> 3
A18: 16 | B18: 12f_Pavarde_16 Vardas_15 | F18: 6A | G18: 5A | O18: 6A | Q18: 6A | R18: 1B | T18: 5A | Y18: 1 | Z18: 2 | AH18: of:=SUM([.C18:.AG18]) -> 3
A19: 17 | B19: 12f_Pavarde_17 Vardas_16 | F19: 6A | G19: 6A | O19: 2B | Q19: 6A | R19: 1B | T19: 5A | U19: 2B | Z19: 2 | AH19: of:=SUM([.C19:.AG19]) -> 2
A20: 18 | B20: 12f_Pavarde_18 Vardas_17 | F20: 6A | G20: 5A | O20: 5A | Q20: 6A | R20: 1B | T20: 5A | X20: 1 | Z20: 2 | AD20: 1 | AH20: of:=SUM([.C20:.AG20]) -> 4
A21: 19 | B21: 12f_Pavarde_19 Vardas_18 | F21: 6A | G21: 6A | O21: 6A | Q21: 6A | R21: 1B | S21: 2B | Z21: 2 | AH21: of:=SUM([.C21:.AG21]) -> 2
A22: 20 | B22: 12f_Pavarde_20 Vardas_19 | F22: 6A | G22: 5A | O22: 5A | Q22: 6A | R22: 1B | T22: 4A | U22: 2B | W22: 1 | Z22: 2 | AH22: of:=SUM([.C22:.AG22]) -> 3
A23: 21 | B23: 12f_Pavarde_21 Vardas_20 | F23: 6A | H23: 5A | K23: 2 | O23: 2B | Q23: 6A | R23: 1B | T23: 5A | U23: 2B | Y23: 1 | Z23: 2 | AH23: of:=SUM([.C23:.AG23]) -> 5
A24: 22 | B24: 12f_Pavarde_22 Vardas_21 | F24: 7A | G24: 6A | O24: 2B | Q24: 6A | R24: 1B | T24: 5A | U24: 2B | Z24: 2 | AD24: 1 | AH24: of:=SUM([.C24:.AG24]) -> 3
A25: 23 | B25: 12f_Pavarde_23 Vardas_21 | F25: 6A | G25: 5A | O25: 5A | Q25: 6A | R25: 1B | T25: 4A | U25: 2B | V25: 1 | Z25: 2 | AH25: of:=SUM([.C25:.AG25]) -> 3
A26: 24 | B26: 12f_Pavarde_24 Vardas_22 | F26: 6A | G26: 6A | O26: 2B | Q26: 6A | R26: 1B | T26: 5A | U26: 2B | Z26: 2 | AH26: of:=SUM([.C26:.AG26]) -> 2
A27: 25 | B27: 12f_Pavarde_25 Vardas_22 | F27: 6A | G27: 6A | L27: 2 | O27: 2B | Q27: 6A | R27: 1B | T27: 5A | V27: 1 | Z27: 2 | AD27: 1 | AH27: of:=SUM([.C27:.AG27]) -> 6
A28: 26 | B28: 12f_Pavarde_26 Vardas_23 | F28: 6A | G28: 6A | M28: 2 | O28: 2B | Q28: 6A | R28: 1B | T28: 5A | V28: 1 | Z28: 2 | AD28: 1 | AH28: of:=SUM([.C28:.AG28]) -> 6

Sheet: sablonas
A1: Eil. | B1: Pavarde Vardas | C1: Dor. ugd. | F1: Leit.k. | G1: 1 užs.kalba | K1: 2 užs.kalba | O1: Ist | P1: Geo | Q1: Mat | R1: Inf | S1: Biol | T1: Fiz | U1: Chem | V1: Menai | Z1: KK | AA1: Pasirenkami | AH1: Viso
A2: Ps | B2: T | C2: E | E2: A1 | F2: V1 | G2: R1 | H2: Pr1 | I2: A2 | J2: V2 | K2: R2 | L2: Pr2 | T2: D | U2: M | V2: Te | W2: S | X2: lot | Y2: isp | Z2: gp | AA2: br | AB2: ek | AC2: pb | AD2: PC
A3: 1 | B3: null | AH3: of:=SUM([.C3:.AG3]) -> 0
A4: 2 | B4: null | AH4: of:=SUM([.C4:.AG4]) -> 0
A5: 3 | B5: null | AH5: of:=SUM([.C5:.AG5]) -> 0
A6: 4 | B6: null | AH6: of:=SUM([.C6:.AG6]) -> 0
A7: 5 | B7: null | AH7: of:=SUM([.C7:.AG7]) -> 0
A8: 6 | B8: null | AH8: of:=SUM([.C8:.AG8]) -> 0
A9: 7 | B9: null | AH9: of:=SUM([.C9:.AG9]) -> 0
A10: 8 | B10: null | AH10: of:=SUM([.C10:.AG10]) -> 0
A11: 9 | B11: null | AH11: of:=SUM([.C11:.AG11]) -> 0
A12: 10 | B12: null | AH12: of:=SUM([.C12:.AG12]) -> 0
A13: 11 | B13: null | AH13: of:=SUM([.C13:.AG13]) -> 0
A14: 12 | B14: null | AH14: of:=SUM([.C14:.AG14]) -> 0
A15: 13 | B15: null | AH15: of:=SUM([.C15:.AG15]) -> 0
A16: 14 | B16: null | AH16: of:=SUM([.C16:.AG16]) -> 0
A17: 15 | B17: null | AH17: of:=SUM([.C17:.AG17]) -> 0
A18: 16 | B18: null | AH18: of:=SUM([.C18:.AG18]) -> 0
A19: 17 | B19: null | AH19: of:=SUM([.C19:.AG19]) -> 0
A20: 18 | B20: null | AH20: of:=SUM([.C20:.AG20]) -> 0
A21: 19 | B21: null | AH21: of:=SUM([.C21:.AG21]) -> 0
A22: 20 | B22: null | AH22: of:=SUM([.C22:.AG22]) -> 0
A23: 21 | B23: null | AH23: of:=SUM([.C23:.AG23]) -> 0
A24: 22 | B24: null | AH24: of:=SUM([.C24:.AG24]) -> 0
A25: 23 | B25: null | AH25: of:=SUM([.C25:.AG25]) -> 0
A26: 24 | B26: null | AH26: of:=SUM([.C26:.AG26]) -> 0
A27: 25 | B27: null | AH27: of:=SUM([.C27:.AG27]) -> 0
A28: 26 | B28: null | AH28: of:=SUM([.C28:.AG28]) -> 0
A29: 27 | B29: null | AH29: of:=SUM([.C29:.AG29]) -> 0
A30: 28 | B30: null | AH30: of:=SUM([.C30:.AG30]) -> 0
A31: 29 | B31: null | AH31: of:=SUM([.C31:.AG31]) -> 0
A32: 30 | B32: null | AH32: of:=SUM([.C32:.AG32]) -> 0